Category,Value,Text
Promid,68099,Voigt & Coll. GmbH (DE )
Promid,70483,Volksbank eG (DE )
Promid,72045,Volksbank Invest Kapitalanl. mbH (AT )
Promid,13241,Volksbank Lübbecker Land eG (DE )
Promid,5653,von der Heydt Invest SA (LU )
Promid,9937,Vontobel Asset Management Inc. (US )
Promid,4827,Vontobel Asset Management S.A. (LU )
Promid,83816,Vontobel Fund Services AG (CH )
Promid,71950,Voskhod Consulting Ltd (CY )
Promid,1566,VP Bank (Luxembourg) SA (LU )
Promid,11043,VP Bank AG (LI )
Promid,68517,VP Finance Gestion (FR )
Promid,10231,VP Fund Solutions (Luxembourg) SA (LU )
Promid,20941,VPV Lebensversicherungs-AG (DE )
Promid,80417,"Vulcan Value Partners, LLC (US )"
Promid,15825,VVB Vermögensverwaltung Braun. GmbH (DE )
Promid,68644,VW RA im Lande Hessen (DE )
Promid,12232,Wallrich Asset Management AG (DE )
Promid,1993,Walser Privatbank AG (AT )
Promid,72076,Warburg Invest KAG MBH (DE )
Promid,5642,Warburg Invest Kapitalanlageges mbH (DE )
Promid,83489,Waterloo Asset Management S.A (LU )
Promid,69823,WAVE Management AG (DE )
Promid,84777,Waverton Investment Management Ltd (GB )
Promid,17268,Waystone Admin Solutions (Lux) S.A. (LU )
Promid,10477,Waystone Management Co. (Lux) S.A. (LU )
Promid,91597,Waystone Mgt Company (IE) Limited (IE )
Promid,95358,WBS Hünicke Vermögensverwaltung GmbH (DE )
Promid,87317,Wealth Fund Services Ltd (CY )
Promid,83314,WealthCap Entity Service GmbH (DE )
Promid,20434,WealthCap Zweitmarkt 3 BASIS GmbH (DE )
Promid,113987,WEALTHGATE GmbH (DE )
Promid,14414,Weiler & Eberhardt Depotverwaltg AG (DE )
Promid,73079,Weinberg Real Estate S.àr.l. (LU )
Promid,4237,Wellington Luxembourg S.à r.l. (LU )
Promid,2081,Wellington Management Company LLP (US )
Promid,4816,Wells Fargo AM (International) Ltd (GB )
Promid,10212,Western Asset Management Company Ltd (GB )
Promid,72419,WestInvest Gesellschaft für Ivtfds (DE )
Promid,18814,Westwood Management Corp. (US )
Promid,80715,WHEB Asset Management LLP (GB )
Promid,22946,Whitelake Capital GmbH (DE )
Promid,11413,Wichmann&Groth Vermögensverw GmbH (DE )
Promid,13806,Wiesbadener Volksbank eG (DE )
Promid,70543,Williamson Investment Management LLP (GB )
Promid,2461,WinCom Versicherungs-Holding AG (DE )
Promid,107558,Winterberg & Seelmeyer GmbH (DE )
Promid,20199,Winton Capital Management Limited (GB )
Promid,87960,WisdomTree Commodity Securities Ld (JE )
Promid,84105,WisdomTree Management Limited (IE )
Promid,89795,Wiseam (FR )
Promid,83469,Woodford Investment Management LLP (GB )
Promid,80726,Woodman Asset Management AG (CH )
Promid,83341,Working Capital Management SA (LU )
Promid,69589,WRM Capital Asset Management SARL (LU )
Promid,3093,Wüstenrot Bank AG Pfandbriefbank (DE )
Promid,2626,WWK Lebensversicherung a.G. (DE )
Promid,83203,Xact Kapitalförvaltning AB (SE )
Promid,73010,York Capital Mgt Global Advisors (US )
Promid,61743,"Yuki Management & Research Co., Ld (JP )"
Promid,20283,Zadig Asset Management S.A. (LU )
Promid,4612,"ZAIS Group, LLC (US )"
Promid,70703,Zantke & Cie. Asset Management GmbH (DE )
Promid,67916,zCapital AG (CH )
Promid,84665,Zeus Asset Management S.A. (LU )
Promid,68951,Zeus Capital S.A. (CH )
Promid,72046,ZZ Vermögensverwaltung GmbH (AT )
Fondsid,-1,Please choose a fund
Compartiment,-1,All sub-funds
Cdtypevar,-1,All periods
Cdtypevar,1,issue date
Cdtypevar,2,one year
Cdtypevar,3,1st january
Cdtypevar,4,six months
Cdtypevar,5,three months
Cdtypevar,6,one month
Cdtypevar,7,previous day
Cdperf,-1,All returns
Cdperf,1,<0 %
Cdperf,2,0 and 5 %
Cdperf,3,5 and 10 %
Cdperf,4,10 and 15 %
Cdperf,5,15 and 25 %
Cdperf,6,25 and 50 %
Cdperf,7,> 50 %
Adminid,-1,All central administrations
Adminid,13956,CSC Global Services (Lux) Sàrl (LU)
Adminid,84129,1167 Capital LLP (GB)
Adminid,91738,12 NP SARL (LU)
Adminid,91334,1741 Fund Management AG (CH)
Adminid,105046,1741 Fund Management AG Lux Br (LU)
Adminid,84437,1741 Fund Solutions AG (CH)
Adminid,70833,3 Banken-Generali Investment-Ges. (AT)
Adminid,110002,6 Monks (6M) (LU)
Adminid,111366,Abeille Asset Management (FR)
Adminid,1595,Aberdeen Asset Management Plc (GB)
Adminid,73051,Aberdeen Private Wealth Mgt Ld (JE)
Adminid,82980,ABN AMRO Investment Solutions (FR)
Adminid,2372,ACATIS Investment KVG mbH (DE)
Adminid,87672,Accuro Fund Solutions AG (LI)
Adminid,99826,AcuFin Corp. LTD (MU)
Adminid,9843,Adepa Asset Management S.A. (LU)
Adminid,103012,AGAMA Advisors Sàrl (LU)
Adminid,73154,AIF Management Services S.A. (LU)
Adminid,68526,Alcyon SA (LU)
Adminid,72050,Alfred Berg Administration A/S (DK)
Adminid,16166,Alfred Berg Kapitalforvaltning AS (NO)
Adminid,10768,Allianz Global Investors GmbH (DE)
Adminid,72367,Allianz Global Investors GmbH Lux. B (LU)
Adminid,5654,Allianz Global Investors Ireland Ltd (IE)
Adminid,1509,Allianz Global Investors Lux. S.A. (LU)
Adminid,71837,Allianz Invest K. mbH (AT)
Adminid,15888,Alm. Brand Invest (DK)
Adminid,80206,Alpha Private Equity Funds Mgt Co (LU)
Adminid,69558,"ALPS Fund Services, Inc (US)"
Adminid,72077,ALTE LEIPZIGER Trust Ivt-Gesellsch. (DE)
Adminid,10474,Alter Domus AA Fund Administration (LU)
Adminid,71113,Alter Domus Depositary Services Sàrl (LU)
Adminid,113644,Alter Domus Fund Services (IE) Ltd (IE)
Adminid,101545,Alter Domus Fund Services SAS (FR)
Adminid,51720,Alter Domus Luxembourg S.à r.l. (LU)
Adminid,18682,Alter Domus Management Company S.A. (LU)
Adminid,100373,Alter Domus Services Malta Limited (MT)
Adminid,101710,Altum Luxembourg S.A. (LU)
Adminid,113762,Amicorp Fund Services Luxembourg (LU)
Adminid,70749,Ampega Investment GmbH (DE)
Adminid,72014,Amundi Austria GmbH (AT)
Adminid,4617,Amundi Deutschland GmbH (DE)
Adminid,112563,Apex Corporate Services CH GmbH (CH)
Adminid,14072,Apex Fd and Corp Products S.A. (LU)
Adminid,103549,Apex Fd Services (Malta) Ltd (MT)
Adminid,101751,Apex Fund Services (BM)
Adminid,81263,Apex Fund Services (Ireland) Limited (IE)
Adminid,107965,Apex Fund Services (Mauritius) Ltd (MR)
Adminid,100366,Apex Fund Services S.A. (LU)
Adminid,100249,AQMetrics Limited (IE)
Adminid,105073,"Aquila Capital Ivt. mbH, Br. Lux (LU)"
Adminid,11322,Arc Asset Management S.A. (LU)
Adminid,84635,Arendt Investor Services S.A. (LU)
Adminid,91837,Ares Management Luxembourg (LU)
Adminid,88491,ARIA Limited (GB)
Adminid,82929,ARKK Compliance Limited (GB)
Adminid,16904,AS Avaron Asset Management (EE)
Adminid,72055,AS LHV Varahaldus (EE)
Adminid,80872,Asia Alternatives Management LLC (US)
Adminid,100644,ASN Beleggingsinst. Beheer B.V. (NL)
Adminid,78308,Astorg Asset Management (LU)
Adminid,112407,Atoz Services S.A. (LU)
Adminid,2109,ATTRAX Financial Services S.A. (LU)
Adminid,81358,Auren Trust S.à .r.l. (LU)
Adminid,22805,AVANA Invest GMBH (DE)
Adminid,101386,Avega Capital Management S.A. (LU)
Adminid,108626,Avega Fund Services S.à r.l. (LU)
Adminid,114168,AXA IM Select France (FR)
Adminid,4200,Axa Investment Managers Deutsc. GmbH (DE)
Adminid,2443,AXA Investment Managers Paris (FR)
Adminid,87829,Aztec Financial Services (JE) LTD (JE)
Adminid,13959,Aztec Financial Services (Lux) S.A. (LU)
Adminid,87377,Aztec Financial Services (NL) B.V. (NL)
Adminid,87523,Baillie Gifford & Co Limited (GB)
Adminid,5127,Banca Popolare di Sondrio SCpA (IT)
Adminid,3135,Banco Inversis S.A. (ES)
Adminid,100927,Bank Frick & Co. AG (LI)
Adminid,10315,Bank of Bermuda Limited (KY)
Adminid,89830,"Bank of Communications Co., Ltd (CN)"
Adminid,87219,Bank of Ireland Securities Services (IE)
Adminid,101402,Bank of New York Mellon (SE)
Adminid,91133,Bank of NYM SA/NV Ndl Frankfurt (DE)
Adminid,72039,Bankhaus Schelhammer & Schattera K. (AT)
Adminid,1679,Bankinter S.A. (ES)
Adminid,1685,Banque Cantonale Vaudoise (CH)
Adminid,1474,Banque de Luxembourg S.A. (LU)
Adminid,18842,Banque de Patrimoines Privés S.A. (LU)
Adminid,2341,Banque Degroof Petercam S.A. (BE)
Adminid,2540,Banque Delen N.V. (BE)
Adminid,1478,Banque et Caisse d'Epargne de l'Etat (LU)
Adminid,42803,Banque Fédérative du Crédit Mutuel (FR)
Adminid,83654,Banque Havilland (Liechtenstein) AG (LI)
Adminid,10496,Banque J. Safra Sarasin (Lux) SA (LU)
Adminid,91843,Banque Lombard Odier & Cie SA (CH)
Adminid,91649,Batipart Participations S.A.S. (LU)
Adminid,4471,BayernInvest Kapitalanlagegesel. mbH (DE)
Adminid,4415,BayernInvest Luxembourg S.A. (LU)
Adminid,108021,Belasko Luxembourg S.à r.l. (LU)
Adminid,1807,Belfius Bank S.A. (BE)
Adminid,72052,BI Management A/S (DK)
Adminid,72812,BI-Invest Endowment Mgt S.à r.l. (LU)
Adminid,68022,BlackRock Asset Management DE AG (DE)
Adminid,71864,BlackRock Cayco Ltd (KY)
Adminid,69409,BlackRock Fund Managers Ltd (GB)
Adminid,81701,BLKB (CH)
Adminid,68856,BNP Paribas AM Europe S.A. (FR)
Adminid,5582,"BNP Paribas AM Europe, Belgian Br. (BE)"
Adminid,6264,"BNP Paribas AM Europe, Netherlands (NL)"
Adminid,1490,BNP Paribas AM Luxembourg S.A. (LU)
Adminid,83607,BNP Paribas Fd Admin. Services (IE)
Adminid,22807,BNP Paribas Fund Services Dublin Ltd (IE)
Adminid,18164,BNP Paribas Real Estate Ivt Mgt Lux (LU)
Adminid,72396,BNP Paribas REIM Germany GmbH (DE)
Adminid,4459,BNP Paribas S.A. (FR)
Adminid,3010,"BNP Paribas SA, German Branch (DE)"
Adminid,73821,"BNP Paribas SA, Italian Branch (IT)"
Adminid,101714,"BNP Paribas SA, Netherlands Branch (NL)"
Adminid,10965,BNP Paribas Securities Services (BE)
Adminid,63786,BNP Paribas Securities Services (FR)
Adminid,83719,BNP Paribas Securities Services SCA (BE)
Adminid,47975,BNP Paribas Trust Corporation UK Ld (GB)
Adminid,69545,"BNP Paribas, Dublin Branch (IE)"
Adminid,6314,"BNP Paribas, London Branch (GB)"
Adminid,100950,"BNP PARIBAS, Succursale à Monaco (MC)"
Adminid,15084,"BNP Paribas, Succursale de Lux (LU)"
Adminid,21290,BNY Mellon Fd Services (Ireland) Ltd (IE)
Adminid,22755,BNY Mellon Fund Managers Limited (GB)
Adminid,4356,BNY Mellon Fund Mgt (Luxembourg) SA (LU)
Adminid,81352,BNY Mellon Fund Services (Ireland) (IE)
Adminid,87969,BNY Mellon Fund Services (Ireland) (IE)
Adminid,22697,BNY Mellon Ivt Servicing (Intl) Ltd (IE)
Adminid,72252,BNY Mellon Service KAG (DE)
Adminid,21679,Bolder Luxembourg S.A. (LU)
Adminid,15042,"BONYM SA/NV, LUXEMBOURG BRANCH (THE) (LU)"
Adminid,87922,BOV Fund Services Limited (MT)
Adminid,5813,BRED Banque Populaire (FR)
Adminid,93322,Bridge Fund Management Ltd (IE)
Adminid,86605,Broad Street Luxembourg Sarl (LU)
Adminid,3863,Brown Brothers Harriman & Co. (US)
Adminid,83289,Brown Brothers Harriman & Co. (US)
Adminid,1491,Brown Brothers Harriman (Lux) S.C.A. (LU)
Adminid,17971,Brown Brothers Harriman Fd Ad. Serv. (IE)
Adminid,65675,Brown Brothers Harriman TS Ld (IE)
Adminid,4569,C Worldwide AM Fondsmæglerselskab (DK)
Adminid,4532,C WorldWide Fund Management S.A. (LU)
Adminid,108497,CA Indosuez (FR)
Adminid,4856,CA Indosuez Fund Solutions (LU)
Adminid,11841,CACEIS Bank (FR)
Adminid,110856,CACEIS BANK SPAIN S.A. (ES)
Adminid,5078,"CACEIS Bank, Belgium Branch (BE)"
Adminid,17167,"CACEIS Bank, Deutschland Branch (DE)"
Adminid,19422,"CACEIS Bank, Ireland Branch (IE)"
Adminid,80269,"CACEIS Bank, Italy Branch (IT)"
Adminid,2758,"CACEIS Bank, Luxembourg Branch (LU)"
Adminid,69457,"CACEIS Bank, Netherlands Branch (NL)"
Adminid,14886,"CACEIS Bank, Switzerland Branch (CH)"
Adminid,93854,"CACEIS Bank, UK Branch (GB)"
Adminid,19134,CACEIS Fund Administration (FR)
Adminid,84767,CACEIS HK Trust Co Ltd (HK)
Adminid,20960,CACEIS Investor Services Bank France (FR)
Adminid,1577,CACEIS Investor Services Bank S.A. (LU)
Adminid,6046,CACEIS Investor Services Bank SA CH (CH)
Adminid,22699,CACEIS Investor Services Bank SA IRL (IE)
Adminid,19962,CACEIS Investor Services Bank SA IT (IT)
Adminid,18403,CACEIS Investor Services Belgium (BE)
Adminid,22008,CACEIS Investor Services Ireland Ld (IE)
Adminid,101429,CACEIS Investor Services Trust UK (GB)
Adminid,19421,CACEIS Ireland Limited (IE)
Adminid,5470,CACEIS Netherlands (NL)
Adminid,80363,CAIAC Fund Management AG (LI)
Adminid,70227,Caibuo Capital SARL (LU)
Adminid,91561,Calamatta Cuschieri Fund Services Ld (MT)
Adminid,16637,Capfi Delen Asset Management S.A. (BE)
Adminid,67941,Capita Financial Admin (IE) Ltd (IE)
Adminid,22962,Capita Financial Administrators Ltd (GB)
Adminid,87929,Capita Registrars Ltd (GB)
Adminid,1875,Carnegie Fonder AB (SE)
Adminid,83126,"Castik Capital, S.à r.l. (LU)"
Adminid,72253,Catella Real Estate AG (DE)
Adminid,88030,CBRE Global Ivt Administration Lux (LU)
Adminid,115236,CBRE Luxembourg (LU)
Adminid,97262,CC Fund Services (Malta) Limited (MT)
Adminid,107632,"Centaur Fund Services US, Inc (US)"
Adminid,14348,Centralis S.A. (LU)
Adminid,14965,CF Fund Services S.A. (LU)
Adminid,101750,Circle Investment Support Services (NL)
Adminid,10148,CITCO Bank Nederland N.V. Lux Branch (LU)
Adminid,81486,Citco Fund Services (CI) Ld (KY)
Adminid,11503,Citco Fund Services (Curaçao) N.V. (AN)
Adminid,71937,Citco Fund Services (Ireland) Ld (IE)
Adminid,2743,Citco Fund Services (Luxembourg) S.A (LU)
Adminid,22839,Citco Fund Services (Nederland) B.V. (NL)
Adminid,93367,Citco Fund Services Guernsey Ltd (GG)
Adminid,13976,Citco Reif Services (Luxembourg) SA (LU)
Adminid,65729,Citibank Europe plc (IE)
Adminid,1493,Citibank Europe PLC (Lux. Br.) (LU)
Adminid,100891,Citibank Europe Plc Netherlands B (NL)
Adminid,83373,Citibank Europe plc UK Branch (GB)
Adminid,66589,"Citibank International Plc, Ireland (IE)"
Adminid,19004,Citibank N.A. London Branch (GB)
Adminid,101484,"Citibank, N.A., Hong Kong Branch (HK)"
Adminid,98241,CLCF Partners S.A. (LU)
Adminid,94690,Colmore PS Ltd (GB)
Adminid,72512,Commerz Real Fund Management (LU)
Adminid,72395,Commerz Real Investmentg. mbH (DE)
Adminid,2269,C-QUADRAT Kapitalanlage AG (AT)
Adminid,88099,Credit Agricole Bank Romania S.A. (RO)
Adminid,60911,Crédit Coopératif (FR)
Adminid,1787,Crédit Industriel et Commercial (FR)
Adminid,6146,Crédit Mutuel Asset Management (FR)
Adminid,84611,Credit Suisse Asset Management (CH)
Adminid,22133,Credit Suisse Fds AG (CH)
Adminid,80422,Cromwell Funds Management Limited (AU)
Adminid,87896,CS Fd Services (IE) Ltd (IE)
Adminid,2666,Danske Bank A/S (DK)
Adminid,15908,Danske Invest Management A/S (DK)
Adminid,16867,DB Advisors Sicav (LU)
Adminid,2242,Deka International S.A. (LU)
Adminid,19786,Deka Investment GmbH (DE)
Adminid,100766,"Deka Vermögensmanagement GmbH, Br LU (LU)"
Adminid,1476,Delen Private Bank Luxembourg S.A. (LU)
Adminid,70756,Deloitte Legal (LU)
Adminid,2092,Deloitte Tax and Consulting SàRL (LU)
Adminid,20724,Delta Lloyd N.V. (NL)
Adminid,1575,Deutsche Bank Luxembourg S.A. (LU)
Adminid,72059,Dierickx Leys Private Bank N.V. (BE)
Adminid,1779,Dinamik S.A. (LU)
Adminid,112546,Divergent Investments S.à r.l. (LU)
Adminid,72868,DLA Piper Luxembourg (LU)
Adminid,25881,DNB Bank ASA (NO)
Adminid,74157,Domos FS Limited (GB)
Adminid,4877,DST Financial Services Intl Ld (GB)
Adminid,15446,Dubly Douilhet Gestion (FR)
Adminid,11432,Dubly Transatlantique Gestion (FR)
Adminid,109892,Duke Street General Partner Limited (GB)
Adminid,78332,"Dunross & CO S.A., SICAV-SIF (LU)"
Adminid,99940,DWS International GmbH (DE)
Adminid,5725,DWS Investment GmbH (DE)
Adminid,1510,DWS Investment S.A. (LU)
Adminid,1511,DZ Privatbank S.A. (LU)
Adminid,70945,ECE Real Estate Partners S. à r.l. (LU)
Adminid,1486,Edmond de Rothschild (Europe) (LU)
Adminid,1910,Edmond de Rothschild (France) (FR)
Adminid,10645,Edmond de Rothschild Asset Mgt (LU)
Adminid,12669,EFG Bank (Luxembourg) S.A. (LU)
Adminid,15974,Egns-INVEST Investeringsforvaltning. (DK)
Adminid,98061,Elmfield Limited (HK) (HK)
Adminid,83542,Engelwood Global Services (LU)
Adminid,113732,Epic Fund Services (Guernsey) Ld (GG)
Adminid,109872,EQT Exeter Services Luxembourg (LU)
Adminid,88485,Equi Capital Market SARL (LU)
Adminid,96225,Equinoxe Alternative Ivt Services (IE)
Adminid,13967,Equiom (Luxembourg) S.A. (LU)
Adminid,100518,Equity Trustees Fd Services (IE) Ltd (IE)
Adminid,100128,Equity Trustees Fund Services (GB)
Adminid,97797,Erste Asset Management GmbH (AT)
Adminid,6336,Erste-Sparinvest KAG (AT)
Adminid,77887,Estera Trust (Jersey) Limited (JE)
Adminid,93546,ESTM Ltd (MT)
Adminid,72254,ETFlab Investment GmbH (DE)
Adminid,96292,Eurazeo Funds Management Luxembourg (LU)
Adminid,89812,EURO NET ASSET VALUE (FR)
Adminid,1512,Eurobank Private Bank Lux S.A. (LU)
Adminid,88450,Euromobiliare AM SGR S.p.A. Lxg (LU)
Adminid,99863,Europe Dvt Gnl Part Fdr S.à r.L. (LU)
Adminid,71655,European Fd Administration France (FR)
Adminid,72072,Evli Fund Management Company Ltd (FI)
Adminid,87665,Evli-Rahastoyhtiö Oy (FI)
Adminid,84160,F&C Administration Centre (GB)
Adminid,88564,F&C Investment Business Limited (GB)
Adminid,77375,"F. VANLANSCHOT Bankiers, N.V. (BE)"
Adminid,100487,Fexserv Fund Services (Malta) Ld (MT)
Adminid,90434,FideField S.à r.l. (LU)
Adminid,14009,Fiducenter S.A. (LU)
Adminid,81399,Fiduciaire Treuconsult S.A. (LU)
Adminid,14010,Fidupar S.A. (LU)
Adminid,14973,Field Conseil Sàrl (LU)
Adminid,1516,FIL (Luxembourg) S.A. (LU)
Adminid,69732,FIL Fund Management (Ireland) Ltd (IE)
Adminid,4331,FIL Investmen Mgt (Lux) S.àr.l. (LU)
Adminid,83441,FIL Investment Services (UK) Limited (GB)
Adminid,4709,FIL Investments International (GB)
Adminid,88379,Financière d’Uzès (FR)
Adminid,21554,Finexis S.A. (LU)
Adminid,19250,First Private Investment Mgt KAG mbH (DE)
Adminid,87439,First State Investment Mgt (UK) Ld (GB)
Adminid,68302,Flossbach von Storch Invest S.A. (LU)
Adminid,72070,Fondita Rahastoyhtiö Oy (FI)
Adminid,9931,Fonditel Gestion (ES)
Adminid,80307,Formuepleje A/S (DK)
Adminid,72062,Formuepleje Fund Management A/S (DK)
Adminid,2099,Forvis Mazars (LU)
Adminid,73091,Forvis Mazars Advisory Services (LU)
Adminid,98592,France Titrisation (FR)
Adminid,73196,Franklin Templeton Fund Mgt Ld (GB)
Adminid,17774,Franklin Templeton Investments (Asia (HK)
Adminid,89834,FSI S.G.R. S.p.A. (IT)
Adminid,97950,FSQ Demo Cy (LU) Branch (LU)
Adminid,1521,FTIS Sàrl (LU)
Adminid,19620,Fund Solutions SCA (LU)
Adminid,107564,fundcraft Services S.à r.l. (LU)
Adminid,4692,Fundpartner Solutions (Europe) S.A. (LU)
Adminid,71821,FundPartner Solutions (Suisse) SA (CH)
Adminid,17147,FundRock LIS S.A. (LU)
Adminid,5093,FundRock Management Company S.A. (LU)
Adminid,94563,Funds-Axis Limited (GB)
Adminid,4783,Fundsight S.A (LU)
Adminid,21695,Fundsmith LLP (GB)
Adminid,72836,Fundsquare Demo Company (LU) (LU)
Adminid,60589,GAM Fund Management Limited (IE)
Adminid,17638,GAM Investment Mgt (Switzerland) SA (CH)
Adminid,101568,Ganado SARL (LU)
Adminid,17893,Gen II Fund Services (Luxembourg) (LU)
Adminid,100089,"Gen II Fund Services, LLC (US)"
Adminid,15836,GEN II Luxembourg Services S.A R.L. (LU)
Adminid,5641,Generali Investments Deutschland (DE)
Adminid,2632,Gérifonds S.A. (CH)
Adminid,2754,Gestador S.A. (LU)
Adminid,84301,Gestman S.A. (LU)
Adminid,72811,Global General Partner S.A. (LU)
Adminid,80805,GlobeOp Financial Services (CYM) Ld (KY)
Adminid,80664,GlobeOp Financial Services (Ireland) (IE)
Adminid,12166,Golding Capital Partners Lux SA (LU)
Adminid,84119,GOLUB CAPITAL PARTNERS INT10 (KY)
Adminid,84118,GOLUB CAPITAL PARTNERS INT9 (KY)
Adminid,84587,"GOLUB CAPITAL PRTNRS INTLL 11, L.P. (KY)"
Adminid,17258,Grant Thornton Financial Services (LU)
Adminid,84421,GRESHAM Banque S.A. (FR)
Adminid,115187,GS & Co. LLC (US)
Adminid,15982,Gudme Raaschou Invest A/S (DK)
Adminid,72019,Gutmann Kapitalanlageakt. (AT)
Adminid,2281,Handelsbanken Fonder AB (SE)
Adminid,6023,HANSAINVEST Hanseatische Ivt GmbH (DE)
Adminid,80804,Harmonic Fund Services (KY)
Adminid,101774,Harmonic Fund Services Ireland Ltd (IE)
Adminid,83191,Harmonic Fund Services Luxembourg SA (LU)
Adminid,17414,Hauck & Aufhäuser AS S.A. (LU)
Adminid,2709,Hauck & Aufhäuser Fund Services S.A. (LU)
Adminid,3100,Hauck Aufhäuser Lampe Privatbank AG (DE)
Adminid,73099,HedgeServ (Luxembourg) S.à r.l. (LU)
Adminid,71645,Hines Luxembourg Investment Mgt (LU)
Adminid,88548,HLD Associés Europe (LU)
Adminid,80321,Horseman Capital Management Limited (GB)
Adminid,87697,HOWZAT Asset Managers S.à r.l. (LU)
Adminid,115235,HSBC AM (Fund Services UK) Limited (GB)
Adminid,22799,HSBC Bank plc (GB)
Adminid,10774,"HSBC Continental Europe, Dublin (IE)"
Adminid,93379,"HSBC Continental Europe, Lux branch (LU)"
Adminid,11674,HSBC Global Asset Management (France (FR)
Adminid,5398,HSBC Global Asset Mgt (Hong Kong) Ld (HK)
Adminid,5086,HSBC Institutional Trust Services (HK)
Adminid,22859,HSBC Management (Guernsey) Limited (GG)
Adminid,4869,HSBC Securities Services (Guernsey) (GB)
Adminid,96477,HSBC Securities Services (Ireland) (IE)
Adminid,22366,HSBC Securities Services (Uk) Ltd (GB)
Adminid,10773,HSBC Securities Services Limited (IE)
Adminid,100875,HSBC SS (Bermuda) Ltd (BM)
Adminid,1524,HSBC Trinkaus Investment Managers SA (LU)
Adminid,12083,HSBC Trustee (Cayman) Limited (VG)
Adminid,11868,ID-Sparinvest A/S (DK)
Adminid,71805,IFM Independent Fund Management AG (LI)
Adminid,13301,IFS Independent Financial Service AG (CH)
Adminid,106386,IFSL International Ltd (IE)
Adminid,20306,Ignis Asset Management (GB)
Adminid,82664,IK Investment Partners Aifm (LU)
Adminid,94216,INDUNA S.A. (LU)
Adminid,98540,Indus Valley Partners India (Pvt.) (IN)
Adminid,1684,ING Belgique S.A. (BE)
Adminid,84348,Innovation Nest II GP sàrl (LU)
Adminid,68057,Institutional Investment Partners (LU)
Adminid,4741,Inter Fund Management S.A. (LU)
Adminid,98417,International Fd Services (N.A) LLC. (US)
Adminid,87557,International Financial Data Serv. (GB)
Adminid,14958,Internationale Kapitalanlagegesellsc (DE)
Adminid,1558,Intesa Sanpaolo Bank Luxembourg S.A. (LU)
Adminid,11507,Intesa Sanpaolo Wealth Mgt (LU)
Adminid,99795,IntReal Luxembourg S.A. (LU)
Adminid,93257,Invesco Administration Centre (GB)
Adminid,5118,INVESCO Asset Management Asia Ltd (HK)
Adminid,16095,Invesco Global Asset Management Ltd (IE)
Adminid,82119,Invesco Perpetual Administration C (GB)
Adminid,15453,Invesco Real Estate Management Sàrl (LU)
Adminid,87485,Invest Administration A/S (DK)
Adminid,84021,Investment Fund Services Limited (GB)
Adminid,81252,IPES (Jersey) Limited (JE)
Adminid,10937,IQ-EQ (Luxembourg) S.A. (LU)
Adminid,6243,J. Safra Sarasin Investmentfonds AG (CH)
Adminid,3561,J.P. Morgan Administration Serv. Ltd (IE)
Adminid,1529,J.P. Morgan Bank Luxembourg S.A. (LU)
Adminid,19435,"J.P. Morgan Chase Bank, N.A. (GB)"
Adminid,17159,J.P. Morgan Europe Limited (GB)
Adminid,85065,J.P. Morgan Europe Limited (GB)
Adminid,71673,J.P. Morgan Management (Jersey) Ld (JE)
Adminid,21358,J.P. Morgan Private Investments Inc (US)
Adminid,107471,J.P. Morgan SE - Luxembourg Branch (LU)
Adminid,3504,J.P. Morgan Securities plc (GB)
Adminid,80793,JF India Management Limited (VG)
Adminid,22560,JP Morgan Bank (Ireland) plc (IE)
Adminid,90003,JP Morgan PE Real Estate Services (LU)
Adminid,1530,JPMorgan Asset Management (EU) Sàrl (LU)
Adminid,17793,JPMorgan Chase & Co. (US)
Adminid,2144,JPMorgan Chase Bank N.A. (US)
Adminid,3506,"JPMorgan Chase Bank, London Branch (GB)"
Adminid,80806,"JPMorgan Chase Bank, N.A. Singapore (SG)"
Adminid,3563,JPMorgan Funds (Asia) Limited (HK)
Adminid,73384,JPMorgan Hedge Fund Services Ld (IE)
Adminid,18791,JTC (Luxembourg) S.A. (LU)
Adminid,112565,JTC Corporate Services (Luxembourg) (LU)
Adminid,87762,JTC Fund Services (UK) Limited (GB)
Adminid,103087,JTC Fund Solutions (GG Ltd) (GG)
Adminid,72026,Julius Meinl Investment GmbH (AT)
Adminid,113763,Juniper Square Luxembourg S.à r.l. (LU)
Adminid,22568,Jupiter Unit Trust Managers Limited (GB)
Adminid,17292,Jyske Invest Fund Management A/S (DK)
Adminid,10125,Kairos Partners SGR S.p.A. (IT)
Adminid,72397,KanAm Grund Kapitalanlag. mbH (DE)
Adminid,11710,KAS BANK N.V. (NL)
Adminid,72387,KAS Investment Servicing GmbH (DE)
Adminid,5531,KBC Asset Management NV (BE)
Adminid,1907,Kempen & Co N.V. (NL)
Adminid,72023,KEPLER-FONDS Kapital. m.b.H. (AT)
Adminid,80659,Kinesis Holdings I Limited (BM)
Adminid,81419,KPMG Services S.à R.L. (LU)
Adminid,1532,Kredietrust Luxembourg S.A. (LU)
Adminid,2383,Kreissparkasse Köln (DE)
Adminid,1676,Landesbank Berlin Investment GmbH (DE)
Adminid,71264,Langham Hall Luxembourg S.à r.l. (LU)
Adminid,87868,Lawaisse beursvennootschap NV (BE)
Adminid,67821,Lazard Asset Management (DE) GmbH (DE)
Adminid,72504,Lazard Frères Gestion SAS (FR)
Adminid,18157,LBBW Asset Management Invest. mbH (DE)
Adminid,14582,"LBREP II Europe S.à R.L., SICAR (LU)"
Adminid,14583,"LBREP III Europe S.à R.L., SICAR (LU)"
Adminid,68129,Lecocqassociate Ltd (MT)
Adminid,80197,Legal & General Unit Trust Managers (GB)
Adminid,22696,Legg Mason Investment Funds Limited (GB)
Adminid,68230,LGT Financial Services AG (LI)
Adminid,111978,LGT Fund Administrators (Lux) Sàrl (LU)
Adminid,72247,LHI Management Luxembourg S.A. (LU)
Adminid,88347,Link Alternative Fund Administrators (GB)
Adminid,100094,Link Fund Administrators (IRL) Ld (IE)
Adminid,22950,LLB Fund Services AG (LI)
Adminid,72012,LLB Invest Kapitalanlagegesell. mbH (AT)
Adminid,100448,LLB Swiss Investment AG (CH)
Adminid,18836,Lombard Odier Funds (Europe) S.A. (LU)
Adminid,1536,LRI Invest S.A. (LU)
Adminid,98590,LTIDPL IndvIT Services LTD (India) (IN)
Adminid,87606,Lupus alpha Investment GmbH (DE)
Adminid,54206,Lupus alpha KAG mbH (DE)
Adminid,21542,Luxembourg Fund Services S.A. (LU)
Adminid,15282,Luxempart (LU)
Adminid,10274,M&G Securities Limited (GB)
Adminid,81804,M3 Investment Group (Lux) Sàrl (LU)
Adminid,100608,Maitland Administration (GG) Ltd (GG)
Adminid,80560,Maitland Administration Limited (US)
Adminid,87765,Maitland Institutional Services Ltd (GB)
Adminid,6223,Maitland Luxembourg S.A. (LU)
Adminid,17491,Man Fund Management (Guernsey) Ltd (GG)
Adminid,84098,Maples FS Holdings Ltd (KY)
Adminid,80415,Maples Fund Services (Ireland) Ld (IE)
Adminid,14053,MaplesFS (Luxembourg) S.A. (LU)
Adminid,81599,Marlborough Fund Managers Limited (GB)
Adminid,73142,Massena Partners SA (LU)
Adminid,20008,Masséna Wealth Management (LU)
Adminid,72022,MASTERINVEST Kapitalanlage GmbH (AT)
Adminid,10000,MEAG MUNICH ERGO Kapitalanlag. mbH (DE)
Adminid,71260,Median Services (Lux) SA (LU)
Adminid,13378,Metzler Asset Management GmbH (DE)
Adminid,72191,Metzler Investment GmbH (DE)
Adminid,72410,Metzler Ireland Limited (IE)
