Category,Value,Text
Idpays,-1,All jurisdictions
Idpays,0,Non luxembourg jurisdiction
Idpays,17,Australia
Idpays,18,Austria
Idpays,28,Bahamas
Idpays,22,Belgium
Idpays,32,Bermuda
Idpays,236,British Virgin Islands
Idpays,41,Canada
Idpays,58,Cayman Islands
Idpays,45,China
Idpays,50,Cook Islands
Idpays,59,Cyprus
Idpays,60,Czech Republic
Idpays,64,Denmark
Idpays,72,Estonia
Idpays,74,Finland
Idpays,77,France
Idpays,61,Germany
Idpays,84,Gibraltar
Idpays,90,Greece
Idpays,94,Guernsey
Idpays,98,Hong Kong
Idpays,111,Iceland
Idpays,105,India
Idpays,109,Iran
Idpays,108,Ireland
Idpays,106,Isle of Man
Idpays,113,Italy
Idpays,117,Japan
Idpays,115,Jersey
Idpays,136,Latvia
Idpays,131,Liechtenstein
Idpays,135,Luxembourg
Idpays,157,Malaysia
Idpays,147,Malta
Idpays,152,Mauritania
Idpays,155,Mauritius
Idpays,143,Mexico
Idpays,139,Monaco
Idpays,166,Netherlands
Idpays,9,Netherlands Antilles
Idpays,167,Norway
Idpays,173,Panama
Idpays,182,Portugal
Idpays,188,Romania
Idpays,210,Seychelles
Idpays,194,Singapore
Idpays,207,Slovenia
Idpays,247,South Africa
Idpays,124,South Korea
Idpays,71,Spain
Idpays,208,Sweden
Idpays,43,Switzerland
Idpays,225,Taiwan
Idpays,223,Türkiye
Idpays,81,United Kingdom
Idpays,231,United States
Idpays,1,Unknown
Idpays,237,US Virgin islands
Promid,-1,Please choose a promoter
Promid,106385,10xDNA Capital Partners GmbH (DE )
Promid,84129,1167 Capital LLP (GB )
Promid,105046,1741 Fund Management AG Lux Br (LU )
Promid,84681,2Xideas AG (CH )
Promid,70833,3 Banken-Generali Investment-Ges. (AT )
Promid,69075,360 AM (FR )
Promid,72481,360Hixance am (FR )
Promid,21816,3P Solar GmbH (DE )
Promid,18977,3TS Capital Partners Ltd (FI )
Promid,105872,7orca Asset Management AG (DE )
Promid,68318,8a+ Investimenti SGR S.p.A (IT )
Promid,87242,A Plus Finance (FR )
Promid,87009,A&G Banca Privada S.A. (ES )
Promid,22375,"A&G Luxembourg AM, S.A. (LU )"
Promid,80369,A&L Listing Limited (IE )
Promid,80735,A2Gestion (FR )
Promid,101295,AAC Alpha GmbH (DE )
Promid,84096,Abalone Asset Management Ltd (MT )
Promid,69410,"Abante Asesores Gestion SGIIC, S.A. (ES )"
Promid,73858,Abaris Investment Management AG (CH )
Promid,16356,Aberdeen AM Ltd Aberdeen (GB )
Promid,1595,Aberdeen Asset Management Plc (GB )
Promid,72421,Aberdeen Asset Mgt Gestion SNC (FR )
Promid,83811,Aberdeen Direct Property (Hold) Ld (GB )
Promid,73051,Aberdeen Private Wealth Mgt Ld (JE )
Promid,10835,Aberdeen Property Invest. Corporate (NO )
Promid,5710,Aberdeen Property Investors Hold. AB (SE )
Promid,21320,ABN AMRO AIS Holding B.V. (NL )
Promid,82980,ABN AMRO Investment Solutions (FR )
Promid,71802,abrdn Fund Managers Limited (GB )
Promid,13942,abrdn Investments Luxembourg S.A. (LU )
Promid,78353,Absalon Cap Fondsmæglerselskab A/S (DK )
Promid,26745,Abu Dhabi Investment Company (AE )
Promid,71806,ACATIS Fair Value Investment AG (CH )
Promid,2372,ACATIS Investment KVG mbH (DE )
Promid,12828,Accendo Capital Managers S.à.r.l. (LU )
Promid,71423,Access Capital Partners Group (BE )
Promid,87672,Accuro Fund Solutions AG (LI )
Promid,72423,Acer Finance (FR )
Promid,87460,acevo GmbH (DE )
Promid,113939,AcomeA SGR S.p.A. (IT )
Promid,70834,ACP Partners Investment Managers (IE )
Promid,17413,ACPI Investments Limited (GB )
Promid,5679,ACT Currency Partner AG (CH )
Promid,72422,Actis Asset Management (FR )
Promid,17665,ADA a.s.b.l. (LU )
Promid,93259,ADCB Asset Management Limited (AE )
Promid,18609,Adenium SGR S.p.A (IT )
Promid,9843,Adepa Asset Management S.A. (LU )
Promid,101010,Aditum Investment Management Limited (AE )
Promid,81708,Advenis Investment Managers (FR )
Promid,69602,Advisory Invest GmbH (AT )
Promid,10167,Aegon Asset Management UK plc (GB )
Promid,84371,Aegon Investment Management B.V. (NL )
Promid,72424,Aesope Gestion de Portefeuilles (FR )
Promid,91309,AFD Fund Management Ltd (LU )
Promid,108998,AFDGP Luxembourg SARL (LU )
Promid,11321,AFFM S.A. (LU )
Promid,72427,Aforge Degroof Family Office (FR )
Promid,5516,AG Insurance SA/NV (BE )
Promid,71835,AGEAS (FR )
Promid,105974,Agence Française du Patrimoine (FR )
Promid,114059,Aguja Capital GmbH (DE )
Promid,80591,Ahead Wealth Solutions AG (LI )
Promid,84262,AHP Capital Management GmbH (DE )
Promid,97778,AIA Investment Management Private Ld (SG )
Promid,80364,AIF Alternativ Invest Finance AG (LI )
Promid,68058,AIFM Services S.A. (LU )
Promid,100982,AKO Capital LLP (GB )
Promid,21181,Akragas AG (CH )
Promid,72378,Alatus Capital S.A. (CH )
Promid,87987,"Albatros Activos XXI EAFI, S.L. (ES )"
Promid,19391,Albemarle Asset Management Ltd. (GB )
Promid,17012,Alcentra Limited (GB )
Promid,80800,Alegra Capital Lie AG (LI )
Promid,1607,Alena S.A. (BE )
Promid,72425,Alexandre Finance SAS (FR )
Promid,97979,Alfred Berg Fonder AB (SE )
Promid,16162,Alfred Berg Kapitalförvaltning AB (SE )
Promid,16166,Alfred Berg Kapitalforvaltning AS (NO )
Promid,20599,Algebris (Luxembourg) S.à r.l. (LU )
Promid,83232,Algebris (UK) Limited (GB )
Promid,20600,Algebris Investments (Cayman) Ltd (KY )
Promid,74339,"Alger Management, Ltd. (GB )"
Promid,91934,Alicanto Capital S.G.R. S. p.A. (IT )
Promid,71799,Alienor Capital (FR )
Promid,3130,Allfunds Bank S.A.U. (ES )
Promid,4238,AllianceBernstein (Luxembourg) Sàrl (LU )
Promid,2671,AllianceBernstein L.P. (US )
Promid,10294,AllianceBernstein Limited (GB )
Promid,1610,Allianz (DE )
Promid,101004,Allianz Capital Partners GmbH Lux Br (LU )
Promid,10768,Allianz Global Investors GmbH (DE )
Promid,88507,Allianz Global Investors GmbH IT (IT )
Promid,72367,Allianz Global Investors GmbH Lux. B (LU )
Promid,14353,Allianz Global Investors GmbH UK (GB )
Promid,13030,Allianz Global Investors Italia SGR (IT )
Promid,71837,Allianz Invest K. mbH (AT )
Promid,91677,Allianz Investment Management SE (DE )
Promid,101375,Allied Investment Partners PJSC (AE )
Promid,72895,Allspring Global Investments Lux SA (LU )
Promid,15888,Alm. Brand Invest (DK )
Promid,68370,Alma Capital Investment Management (LU )
Promid,19081,Almal Invest International Inc (BZ )
Promid,19970,Alpcot Capital Management Ltd (GB )
Promid,20616,Alpes Holdings Limited (GI )
Promid,20782,Alpha Bank A. E. (GR )
Promid,21976,Alpha Investor Services Management (LU )
Promid,21673,Alpha Patrimoine S.A. (LU )
Promid,70442,Alpha Trust Mutual Fund Mgt S.A. (GR )
Promid,22338,Alpha UCITS Limited (GB )
Promid,85076,AlphaBee Asset Management S.à r.l. (LU )
Promid,17676,AlphaMundi Group AG (CH )
Promid,84057,AlphaOne Capital Mgt S.à r.l. (LU )
Promid,73096,AlphaOne Management S.à r.l. (LU )
Promid,87711,AlphaTrustMutual Fd & Alt Ivt Fd Mgt (LU )
Promid,89946,Alpinum Investment Management AG (CH )
Promid,107889,Alquant AG (CH )
Promid,111645,Alt Investments B.V. (NL )
Promid,20945,Alta Faubourg S.A.S. (FR )
Promid,80362,Altarocca AM SAS (FR )
Promid,72077,ALTE LEIPZIGER Trust Ivt-Gesellsch. (DE )
Promid,18682,Alter Domus Management Company S.A. (LU )
Promid,21296,Alterfi S.A. (CH )
Promid,113940,ALTERNATIVE PATRIMONIALE (FR )
Promid,92080,Alternative Value Umbrella Manager (LU )
Promid,1834,"Altex Partners Gestion, S.G.I.I.C. (ES )"
Promid,74282,"Althelia Climate Fund GP, S.à r.l. (LU )"
Promid,72428,Altimeo Asset Management (FR )
Promid,83670,Altius Holdings Limited (GB )
Promid,80367,Alto Invest (FR )
Promid,69128,"Altrinsic Global Advisors, LLC (US )"
Promid,91641,Altum Mgt Company (Luxembourg) S.A. (LU )
Promid,108583,Alturis Capital GmbH (DE )
Promid,90897,Altus Management SARL (LU )
Promid,18966,Alvis Asset Management S.à r.l. (LU )
Promid,87921,Amagis Capital Management Ltd (MT )
Promid,72429,Amalthée Gestion SGP (FR )
Promid,115544,Ambienta Sgr S.P.A. (IT )
Promid,2196,American Express Bank Ltd (US )
Promid,99907,AMG Fondsverwaltung AG (CH )
Promid,72431,Amiral Gestion (FR )
Promid,17533,Amonis OFP (BE )
Promid,14939,AMP Capital Investors Intl Hold. Ltd (AU )
Promid,14940,AMP Capital Investors Limited (AU )
Promid,70749,Ampega Investment GmbH (DE )
Promid,72080,Amplegest (FR )
Promid,88098,Amundi Asset Management S.A.I. S.A. (RO )
Promid,2459,Amundi Asset Management S.A.S (FR )
Promid,72014,Amundi Austria GmbH (AT )
Promid,4617,Amundi Deutschland GmbH (DE )
Promid,5965,"Amundi Iberia SGIIC, SA (ES )"
Promid,2944,Amundi Luxembourg S.A. (LU )
Promid,22186,Amundi S.A. (FR )
Promid,6283,Amundi SGR S.p.A. (IT )
Promid,72432,Anaxis Asset Management S.A.S. (FR )
Promid,17659,AndBank Asset Management Luxembourg (LU )
Promid,18626,Andbank Luxembourg S.A. (LU )
Promid,71333,ANF Luxembourg S.A. (LU )
Promid,72412,Angola Growth Management S.A. (LU )
Promid,71331,ansa capital Management GmbH (DE )
Promid,83818,Anstalt Fürst Liechtenstein (LI )
Promid,11658,Antaurus Capital Management B.V (NL )
Promid,72136,Antecedo Asset Management GmbH (DE )
Promid,71347,Antin Infrastructure Partners (GB )
Promid,73002,APAC CREF Luxembourg General Partner (LU )
Promid,114488,Aphilion IM (BE )
Promid,83286,Apis Asset Management (LU )
Promid,10465,APO Asset Management GmbH (DE )
Promid,115076,Apollo Management International LLP (GB )
Promid,75772,APPIA General Partner Sàrl (LU )
Promid,87036,APS Asset Mgt Advisory Limited (VG )
Promid,87465,Apus Capital GmbH (DE )
Promid,3553,AQ Mgt GmbH (DE )
Promid,81464,AQA Capital Ltd (MT )
Promid,19945,AQR Capital Management LLC (US )
Promid,88022,Aquasourca S.A. (LU )
Promid,93361,Aquila Asset Management AG (CH )
Promid,85332,Aquila Capital Investmentgesell (DE )
Promid,105073,"Aquila Capital Ivt. mbH, Br. Lux (LU )"
Promid,72380,Arab Bank (Switzerland) Ltd (CH )
Promid,72374,Arabesque Asset Management Ltd (GB )
Promid,16766,Aramea Asset Management AG_ (DE )
Promid,101305,Aravis Capital Limited (GB )
Promid,19256,Arborescence Capital (FR )
Promid,83487,ARCA Fondi SGR S.p.A. (IT )
Promid,72058,Archeide Lux Sàrl (LU )
Promid,20987,Architas Multi-Manager Limited (GB )
Promid,87951,Archmore GP Sarl (LU )
Promid,88393,Arctic Fund Management AS (NO )
Promid,3669,Arcus Investment Limited (GB )
Promid,57390,Arden Asset Management LLC (US )
Promid,21293,ARDIAN France S.A. (FR )
Promid,91998,Ardian Real Estate II GP S.à r.l. (LU )
Promid,4492,Arendt & Medernach S.A. (LU )
Promid,110037,Arev Partners (FR )
Promid,1625,Argenta Banque d’Epargne S.A. (BE )
Promid,72192,ARGENTUM Asset Management GmbH (DE )
Promid,20379,Argonaut Capital Partners LLP (GB )
Promid,88491,ARIA Limited (GB )
Promid,11966,Aria Structured Investments S.à r.l. (LU )
Promid,20454,Aries Investment Management S.A. (LU )
Promid,19288,Arion Bank hf (IS )
Promid,78395,Arrows Capital AG (CH )
Promid,10584,Artemis Investment Management LLP (GB )
Promid,83683,Ärtzteversorgung Land Brandenburg (DE )
Promid,17821,Ärztekammer (AT )
Promid,14273,Ärztekammer Westfalen-Lippe (DE )
Promid,14274,Ärzteversorgung Brandenburg (DE )
Promid,16904,AS Avaron Asset Management (EE )
Promid,83688,AS BaltCap PLC (EE )
Promid,88230,AS Trigon Asset Management (EE )
Promid,17116,Asesores y Gestores Financieros S.A. (ES )
Promid,17115,Asesores Y Gestores Private Equity (ES )
Promid,13377,Ashburton (Jersey) Limited (JE )
Promid,97700,Ashmore IM (Ireland) Limited (IE )
Promid,2778,Ashmore Investment Management Ltd (GB )
Promid,99801,"Asia Green Real Estate, Switzerland (CH )"
Promid,72614,Asia Growth Capital Management AB (SE )
Promid,83431,ASK 1 Sp. z o. o. (PL )
Promid,71838,Aspect Capital Limited (GB )
Promid,87573,ASPOMA Asset Management GmbH (AT )
Promid,5450,ASR Nederland N.V. (NL )
Promid,11323,Assenagon Asset Management S.A. (LU )
Promid,1627,Assurances Fédérales Bruxelles (BE )
Promid,71453,"Assured Investment Management, LLC (US )"
Promid,68307,Astellon Capital Partners LLP (GB )
Promid,101591,Asteria Investment Managers (CH )
Promid,18028,ATG Abrechnungs-Treuhand GmbH (DE )
Promid,72539,Athymis Gestion (FR )
Promid,6240,Atl. Inv. Mgt. Ltd. (GB )
Promid,72413,Atlantico Europa Capital Lux Sàrl (LU )
Promid,108682,Atlas Responsible Investors SAS (FR )
Promid,100802,AtonRâ Partners S.A. (CH )
Promid,12968,Aubrey Capital Management Ltd (GB )
Promid,68126,Auda Private Equity LLC (US )
Promid,84267,Augusta Vermögensverwaltung GmbH (DE )
Promid,98244,AUM Invest (FR )
Promid,20674,Auretas Family Trust GmbH (DE )
Promid,103090,Auréus Group B.V. (NL )
Promid,72434,Auris Gestion (FR )
Promid,12300,AURORE Invest Fund (LU )
Promid,81598,AUXENSE Gestion SAS (FR )
Promid,22805,AVANA Invest GMBH (DE )
Promid,113815,avant-garde capital GmbH (DE )
Promid,71101,Avenir Finance Investment Managers (FR )
Promid,17356,avesco Financial Services AG (DE )
Promid,83669,Aviabel S.A. (BE )
Promid,83926,Aviron Investment Management (LU )
Promid,17110,Aviva Investors France (FR )
Promid,3188,Aviva Investors Global Services Limi (GB )
Promid,4760,Aviva Investors Group (GB )
Promid,1499,Aviva Investors Luxembourg S.A. (LU )
Promid,87522,Aviva Investors UK Fund Services Ld (GB )
Promid,17429,Aviva Vie (FR )
Promid,87378,AWL Properties I S.C.S. (LU )
Promid,3929,AXA Bank Europe S.A. (BE )
Promid,1632,AXA Group (FR )
Promid,111981,AXA IM Paris - Luxembourg Branch (LU )
Promid,114168,AXA IM Select France (FR )
Promid,4200,Axa Investment Managers Deutsc. GmbH (DE )
Promid,2443,AXA Investment Managers Paris (FR )
Promid,10368,AXA Investment Managers UK Limited (GB )
Promid,21947,Axa Krankenversicherung AG (DE )
Promid,80521,AXA Private Management (FR )
Promid,2495,AXA Real Estate Investment Mgrs SGP (FR )
Promid,72437,Axiom Alternative Investments (FR )
Promid,2417,Axxion S.A. (LU )
Promid,16379,Ayaltis AG (CH )
Promid,4229,Azimut Investments S.A. (LU )
Promid,71451,B & E EQUITIES S.p.A. (IT )
Promid,101280,B.A.U.M. e.V. (DE )
Promid,102846,Baden-Württembergische V. für ÄZT (DE )
Promid,87523,Baillie Gifford & Co Limited (GB )
Promid,20220,Baillie Gifford Overseas Limited (GB )
Promid,22561,Baker Steel Capital Managers LLP (GB )
Promid,87846,Baloise Asset Mgt Switzerland Ltd (CH )
Promid,13615,Baltic Property Trust Asset Mgt S/A (DK )
Promid,68797,Bamboo Capital Partners S.A. (LU )
Promid,1639,Banca del Ceresio S.A. (CH )
Promid,1641,Banca del Sempione S.A. (CH )
Promid,2513,Banca di San Marino (SM )
Promid,2430,Banca Finnat Euramerica S.p.A. (IT )
Promid,3387,Banca Generali S.p.A. (IT )
Promid,20090,Banca March (ES )
Promid,25362,BANCA NAZIONALE DEL LAVORO S.p.A. (IT )
Promid,14338,Banca Patrimoni Sella & C. (IT )
Promid,2846,Banca Zarattini & Co. S.A. (CH )
Promid,18933,Banco Africano de Investimentos S.A. (AO )
Promid,1659,"Banco BANIF, S.A. (ES )"
Promid,1660,Banco Bilbao Vizcaya Argentaria S.A. (ES )
Promid,87241,Banco BPM S.p.A. (IT )
Promid,88671,Banco de Sabadell S.A. (ES )
Promid,4028,Banco de Sabadell S.A. (ES )
Promid,83639,Banco Privado Atlântico - Europa (PT )
Promid,1663,Banco Santander S.A. (ES )
Promid,16611,Bank im Bistum Essen eG (DE )
Promid,3001,Bank J. Safra Sarasin AG (CH )
Promid,15008,Bank of China (Europe) S.A. (LU )
Promid,22878,Bank of Singapore Limited (SG )
Promid,3022,Bank Vontobel AG (CH )
Promid,105657,Bankhaus Bauer AG (DE )
Promid,92131,Bankhaus C. L. Seeliger (DE )
Promid,1678,Bankhaus Ellwanger & Geiger KG (DE )
Promid,4894,Bankhaus Neelmeyer AG (DE )
Promid,72039,Bankhaus Schelhammer & Schattera K. (AT )
Promid,1679,Bankinter S.A. (ES )
Promid,72857,Banor Capital Ltd (GB )
Promid,14887,Banque Bonhôte & Cie S.A. (CH )
Promid,1685,Banque Cantonale Vaudoise (CH )
Promid,1474,Banque de Luxembourg S.A. (LU )
Promid,18842,Banque de Patrimoines Privés S.A. (LU )
Promid,1475,Banque Degroof Petercam Luxembourg (LU )
Promid,2341,Banque Degroof Petercam S.A. (BE )
Promid,1478,Banque et Caisse d'Epargne de l'Etat (LU )
Promid,2292,Banque Fédérative du Crédit Mutuel (FR )
Promid,4852,Banque Hottinguer (FR )
Promid,5645,Banque Internationale à Luxembourg (LU )
Promid,2727,Banque Martin Maurel (FR )
Promid,88692,Banque NagelMackers SA (BE )
Promid,1690,Banque Neuflize OBC (FR )
Promid,72550,Banque Palatine (FR )
Promid,3032,Banque Pictet & Cie S.A. (CH )
Promid,110543,Banque Populaire Grand Ouest (FR )
Promid,1736,Banque Raiffeisen S.C. (LU )
Promid,87506,Banque Saint Olive (FR )
Promid,1710,Banque SYZ S.A. (CH )
Promid,5934,Banque Transatlantique (FR )
Promid,11033,"BanSabadell Inversion, S.A., SGIIC (ES )"
Promid,1712,Bantleon Bank AG (CH )
Promid,2205,Barclays Bank PLC (GB )
Promid,12913,Bardusch & Gehrsitz Vermögensv. MBH (DE )
Promid,5828,Baring Asset Management Ltd (GB )
Promid,84294,Barings (U.K.) Limited (GB )
Promid,83955,Barings LLC (US )
Promid,83513,Barometer Management (Ireland) Ld (IE )
Promid,97803,"Baumann & Cie, Banquiers (CH )"
Promid,13961,Baumann & Partners S.A. (LU )
Promid,98598,BAYER AG (DE )
Promid,5230,Bayerische Vermögen Management AG (DE )
Promid,4471,BayernInvest Kapitalanlagegesel. mbH (DE )
Promid,87197,BayernInvest Kapitalverwaltung (DE )
Promid,4415,BayernInvest Luxembourg S.A. (LU )
Promid,12860,Bayer-Pensionskasse VVaG (DE )
Promid,82873,Bayview Global Opportunities GP (LU )
Promid,3120,BBBank eG (DE )
Promid,17530,BBGI (CH )
Promid,72444,BBR Rogier (FR )
Promid,13962,BCB & Partners S.A. (LU )
Promid,104859,Bcc Risparmio & Previdenza SGRpA (IT )
Promid,91220,BC-ETI Admin S.à r.l. (LU )
Promid,69561,BCI AM Admin General de Fondos SA (CL )
Promid,72445,BDL Capital Management SAS (FR )
Promid,22400,BDT Invest LLP (GB )
Promid,104864,Beka Asset Management SGIIC SA (ES )
Promid,115560,Belem Capital Management S.à r.l (LU )
Promid,81438,Belesta AG (CH )
Promid,1807,Belfius Bank S.A. (BE )
Promid,10993,Bellatrix Asset Management S.A. (LU )
Promid,91222,Bellecapital Partners AG (CH )
Promid,87474,Belvoir Capital AG (CH )
Promid,4309,Berenberg Lux Invest S.A. (LU )
Promid,11226,Bergos AG (CH )
Promid,11784,Berliner Ärzteversorgung (DE )
Promid,1725,Bestinver Gestión S.A. (ES )
Promid,4867,Bethmann Bank AG (DE )
Promid,68206,BETSAH S.A. (LU )
Promid,80590,BFT Investment Managers (FR )
Promid,73379,BG Asset Management S.A. (LU )
Promid,12337,BG Fund Management Luxembourg S.A. (LU )
Promid,1480,BGL BNP Paribas Société Anonyme (LU )
Promid,91776,BICE Inversiones Administradora (CL )
Promid,19255,BI-Invest Compartment S. à r.l. (LU )
Promid,19174,BI-Invest S.à r.l. (LU )
Promid,70097,BIL Manage Invest S.A. (LU )
Promid,98355,BIT Capital GmbH (DE )
Promid,73280,BL General Partner S.à r.l. (LU )
Promid,73055,Blackhawk Coop S.A. (LU )
Promid,105639,BlackPoint Asset Management GmbH (DE )
Promid,4891,BlackRock (Channel Islands) Limited (JE )
Promid,4203,Blackrock (Luxembourg) S.A. (LU )
Promid,2448,BlackRock Advisors (UK) Limited (GB )
Promid,70079,BlackRock AM Schweiz AG (CH )
Promid,22050,BlackRock Asset Management UK Ltd (GB )
Promid,22502,BlackRock Asset Mgt Ireland Ltd (IE )
Promid,71864,BlackRock Cayco Ltd (KY )
Promid,69409,BlackRock Fund Managers Ltd (GB )
Promid,5458,BlackRock Investment Mgt (UK) Ltd (GB )
Promid,81638,Blackstone Alternative Ivt Advisors (US )
Promid,74221,Blackstone Credit BDC Advisors LLC (US )
Promid,74332,Blue Colibri AG (DE )
Promid,15532,Blue Sky Global Investors Limited (GB )
Promid,98261,BlueBalance Capital GmbH (AT )
Promid,2721,BlueBay Asset Management (Services) (GB )
Promid,4241,BlueBay Funds Management Company S.A (LU )
Promid,104856,BlueBox Asset Management SA (CH )
Promid,14723,Bluehouse Capital Advisors Ltd (CY )
Promid,74286,"Bluehouse Property Fund IV GP, Sàrl (LU )"
Promid,87414,BlueOrange Sustainable Capital Fd GP (LU )
Promid,67738,BlueOrchard Asset Mgt (Lux) SA (LU )
Promid,5925,BlueOrchard Finance S.A. (CH )
Promid,87388,BMW Trust e.V. (DE )
Promid,68856,BNP Paribas AM Europe S.A. (FR )
Promid,5582,"BNP Paribas AM Europe, Belgian Br. (BE )"
Promid,1490,BNP Paribas AM Luxembourg S.A. (LU )
Promid,10080,BNP Paribas AM UK Limited (GB )
Promid,1844,BNP Paribas Fortis S.A. (BE )
Promid,88303,BNP Paribas Real Estate Ivt Mgt (FR )
Promid,21114,BNP Paribas Real Estate Ivt Services (FR )
Promid,72396,BNP Paribas REIM Germany GmbH (DE )
Promid,4459,BNP Paribas S.A. (FR )
Promid,15084,"BNP Paribas, Succursale de Lux (LU )"
Promid,72252,BNY Mellon Service KAG (DE )
Promid,83438,boerse.de Finanzportal GmbH (DE )
Promid,91672,Bonafide Wealth Management AG (LI )
Promid,114111,Bootstrap Europe (LU )
Promid,1731,Bordier & Cie (CH )
Promid,89828,Bordier & Cie (France) SA (FR )
Promid,73378,Borletti & Partners S.A. (LU )
Promid,87278,Boursorama SA (FR )
Promid,68507,Boussard & Gavaudan Gestion S.A.S. (FR )
Promid,5577,Bouwfonds Asset Management B.V. (NL )
Promid,87405,Bouwfonds CIF Management S.à r.l. (LU )
Promid,70341,Bovay & Partenaires S.A. (CH )
Promid,12654,BPC Group Limited (BM )
Promid,1651,BPER Banca S.p.A. (IT )
Promid,87385,BPM Capital OÜ (EE )
Promid,72896,"BPM Mezzanine Fund GP, S.à r.l. (LU )"
Promid,88400,Brandes Investment Partners (EU) Ltd (IE )
Promid,70098,BREC Management SARL (LU )
Promid,115297,Bridge Fund Services (IE )
Promid,83334,Broca S.A. (LU )
Promid,114125,Brock Milton Capital AB (SE )
Promid,73993,BRODE Capital Partners Sàrl (LU )
Promid,87698,Brooks Macdonald Funds Limited (GB )
Promid,73997,"Brown Advisory, LLC (US )"
Promid,80195,Brown Shipley & Company Limited (GB )
Promid,14889,Bruellan S.A. (CH )
Promid,19484,Bruno Walter Finance S.A. (CH )
Promid,95388,BRW Finanz AG (DE )
Promid,83456,BTC Investments 2012 S.à r.l. (LU )
Promid,2361,BTG Pactual Europe S.A. (LU )
Promid,91600,"Büttner, Kolber & Partner Ver. GmbH (DE )"
Promid,97995,"Buy & Hold Capital S.G.I.I.C, S.A (ES )"
Promid,108297,BVT Lux S.a r.l. (LU )
Promid,20789,BZ Bank Aktiengesellschaft (CH )
Promid,14933,BZ Berater Zentrum AG (CH )
Promid,93343,C QUADRAT ASSET MANAGEMENT FRANCE (FR )
Promid,4532,C WorldWide Fund Management S.A. (LU )
Promid,93167,C&D Investments S.à r.l. (LU )
Promid,87447,C&M Finances (FR )
Promid,108497,CA Indosuez (FR )
Promid,4856,CA Indosuez Fund Solutions (LU )
Promid,10872,CA Indosuez Gestion (FR )
Promid,2758,"CACEIS Bank, Luxembourg Branch (LU )"
Promid,14886,"CACEIS Bank, Switzerland Branch (CH )"
Promid,71638,Cadelux S.A. (LU )
Promid,70837,CAERUS Debt Investments AG (DE )
Promid,1737,Caisse des Dépôts et Consignations (FR )
Promid,4388,CAIXABANK Asset Management Lux S.A. (LU )
Promid,22372,Calamos Advisors LLC (US )
Promid,113941,Calamos Antetokounmpo Asset Mgt LLC (US )
Promid,84143,Calibrium AG (CH )
Promid,18487,CAM Alternatives GmbH (DE )
Promid,73555,Cambridge Associates Limited (GB )
Promid,2914,Camca Assurance S.A. (LU )
Promid,2216,Camca Réassurance S.A. (LU )
Promid,19439,CamGestion (FR )
Promid,84548,Canaccord Genuity Wealth Limited (GB )
Promid,107411,Candoris (NL )
Promid,2900,Candriam (LU )
Promid,2901,Candriam Belgium (BE )
Promid,2236,Candriam France SA (FR )
Promid,78418,Cantillon Capital Management LLP (US )
Promid,74024,Cape Capital AG (CH )
Promid,16637,Capfi Delen Asset Management S.A. (BE )
Promid,87296,Capital Advisory Partners Ltd (GB )
Promid,73287,Capital Bank – GRAWE Gruppe AG (AT )
Promid,17111,Capital Dynamics Cayman Islands Ltd (KY )
Promid,88210,"Capital International Financial, LLC (US )"
Promid,71454,Capital Invest S.A. (MA )
Promid,17812,CapitalAtWork Foyer Group S.A. (LU )
Promid,70073,Capitell Vermögens-Management AG (DE )
Promid,88561,Capitulum Asset Management GmbH (DE )
Promid,17000,CapMan Real Estate Oy (FI )
Promid,16290,"Capricorn Investment Group, LLC (US )"
Promid,68274,Capricorn Venture Partners N.V. (BE )
Promid,21317,Cardea International Management S.A. (LU )
Promid,66396,CARDIF ASSURANCE-VIE (FR )
Promid,20527,Cardif Lux Vie S.A. (LU )
Promid,1749,Cargill Investor Services Inc. (GB )
Promid,16962,Carlisle Management Company S.C.A. (LU )
Promid,2218,Carmignac Gestion Luxembourg (LU )
Promid,5605,Carmignac Gestion S.A. (FR )
Promid,71244,Carne Global Fund Managers (IE) Ld (IE )
Promid,17702,Carne Global Fund Managers (Lux) SA (LU )
Promid,1875,Carnegie Fonder AB (SE )
Promid,4996,Carnegie Investment Bank AB (SE )
Promid,66456,Carrefour Banque (FR )
Promid,90020,Cartesia S.A.S. (FR )
Promid,16404,"Cartesio Inversiones, S.G.I.I.C. ,SA (ES )"
Promid,18937,Cassa depositi e prestiti S.p.A. (IT )
Promid,88560,Castellain Capital LLP (GB )
Promid,99953,Castlefield Fund Partners Limited (GB )
Promid,67903,Catam Asset Management AG (LI )
Promid,72253,Catella Real Estate AG (DE )
Promid,99857,Cathay Capital Private Equity (FR )
Promid,18884,CB Richard Ellis Investors Holdings (NL )
Promid,18633,CBH - Compagnie Bancaire Helvétique (CH )
Promid,11126,CBRE Clarion Securities LLC (US )
Promid,21479,CBRE Collective Investors Limited (GB )
Promid,21476,CBRE Global Investment Partners S (LU )
Promid,13970,CBRE Global Investors Lux S.à r.l. (LU )
Promid,72448,CBT Gestion (FR )
Promid,78399,CCA Life Settlements (LU )
Promid,69893,Centris Capital AG (AT )
Promid,72681,Cerberus Lux GP S.à r.l. (LU )
Promid,83657,"Cerberus LUX, LLC (US )"
Promid,5548,CFM Indosuez Wealth (MC )
Promid,74973,CFO SIM S.p.A. (IT )
Promid,16925,CFSPAI Malta Co Limited (MT )
Promid,80200,CG Asset Management Limited (GB )
Promid,73781,CGR I GP S.à r.l. (LU )
Promid,91514,Chainberry Asset Management GmbH (DE )
Promid,87793,Chameleon Asset Managemnt AG (CH )
Promid,84413,Charteris Treasury Portf Managers Ld (GB )
Promid,87764,Chelverton Asset Management Limited (GB )
Promid,84685,Cheyne Capital Holdings Limited (VG )
Promid,19037,Cheyne Capital Management (UK) LLP (GB )
Promid,99860,Cheyne Capital SMC Limited (IE )
Promid,113725,Chikara Investments LLP (GB )
Promid,81974,CHINA POST GLOBAL UK LIMITED (GB )
Promid,80286,China Universal AM (Hong Kong) Co Ld (HK )
Promid,87372,China-CEE Management S.à r.l. (LU )
Promid,88189,"Chiron Investment Management, LLC (US )"
Promid,83925,Cholet Dupont S.A. (FR )
Promid,84506,CHOM CAPITAL GmbH (DE )
Promid,72990,CHORUS GmbH (DE )
Promid,101454,Christian Brothers Ivt Services (US )
Promid,80662,Church House Investments Limited (GB )
Promid,4320,CI Fund Services S.A. (LU )
Promid,19513,CIAM (FR )
Promid,4780,Cigogne Management S.A. (LU )
Promid,12437,CIM Investment Management Limited (GB )
Promid,72781,Cinema Gestion S.à r.l. (LU )
Promid,67737,Cinven Manco S.à r.l. (LU )
Promid,11829,Citadel Finance S.A. (CH )
Promid,70495,Citadel Holding for Financial Ivts (EG )
Promid,70533,Citi Private Advisory LLC (US )
Promid,65729,Citibank Europe plc (IE )
