Category,Value,Text
Promid,2722,Pax-Bank eG (DE )
Promid,14299,Payden & Rygel (US )
Promid,70257,PCA Provalia S.à r.l. (LU )
Promid,98520,Pecunia GmbH (DE )
Promid,1977,PEH Wertpapier AG (DE )
Promid,80839,Pemberton AM S.A. (LU )
Promid,83317,Pemberton Asset Mgt Holdings Ltd (JE )
Promid,114191,Pemberton Debt Fund IV GP S.à r.l. (LU )
Promid,19900,Pendragon Management Company S.A. (LU )
Promid,87935,Pensofinance S.A. (CH )
Promid,18876,PensPlan Invest SGR S.p.A. (IT )
Promid,80585,Peregrine Guernsey Limited (GG )
Promid,113747,Perfect Management Services AG (LI )
Promid,2474,Permal Investment Mgt Service Ltd (GB )
Promid,81491,Permian Global General Partner Sàrl (LU )
Promid,81469,Permian Global Management S.à.r.l. (LU )
Promid,83739,Perpetual Investors GmbH (DE )
Promid,102736,Perspektive Asset Managment AG (DE )
Promid,105097,Petershill Partners Group (GB )
Promid,83063,PFA Asset Management (DK )
Promid,98142,pfp Advisory GmbH (DE )
Promid,107671,PGIM Real Estate Management Lux (LU )
Promid,83938,"PGIM, Inc. (US )"
Promid,72625,Pharo Management LLC (US )
Promid,67853,Pharus Management Lux S.A. (LU )
Promid,72553,Phileas Asset Management SAS (FR )
Promid,72552,Philippe Hottinguer & Cie Gestion (FR )
Promid,89823,PhiTrust (FR )
Promid,113993,Phitrust Impact Investors (FR )
Promid,22087,Picard Angst AG (CH )
Promid,72648,Pictet Alternative Advisors SA (CH )
Promid,12724,Pictet Asset Management (Europe) SA (LU )
Promid,4978,Pictet Asset Management S.A. (CH )
Promid,15503,pim Asset Services AG (CH )
Promid,5625,PIMCO Europe Ltd (GB )
Promid,66042,PIMCO Global Advisors IE Limited (IE )
Promid,71232,PineBridge Investment Ireland Ld (IE )
Promid,101018,Ping An of China Asset Mgt HK CL (HK )
Promid,68516,PINK Capital (FR )
Promid,107673,Pinnacle Investment Management (AU )
Promid,11411,Pioneer Investments Austria GmbH (AT )
Promid,101682,Piquemal Houghton Investments S.A.S. (FR )
Promid,2629,Piraeus Bank S.A. (GR )
Promid,107901,Pirate Impact GP S.à r.l. (LU )
Promid,18940,PKO Bank Spolka Akcyjna (PL )
Promid,10756,Platinium Gestion (FR )
Promid,5731,Platinum Capital Management Ltd (GB )
Promid,72555,Pleiade Asset Management (FR )
Promid,113924,Pleion SA Genève (CH )
Promid,68505,Plenum Investments AG (CH )
Promid,5262,PMG Fonds Management AG (CH )
Promid,115110,PMG Investment Solutions AG (CH )
Promid,87626,PMT Matrix Capital Ltd (CY )
Promid,21923,PO Söderberg & Partner AB (SE )
Promid,86965,Polar Asset Management Partners Inc. (CA )
Promid,70094,Polar Capital LLP (GB )
Promid,80771,"Polen Capital Management, LLC (US )"
Promid,71438,Portikus Investment GmbH (DE )
Promid,87384,Portugal Real Estate Opport. Mgr (LU )
Promid,88322,PORTZAMPARC Gestion (FR )
Promid,20357,Positron Alternative Investments AS (NO )
Promid,86938,Post Carbon Internet S.à r.l. (LU )
Promid,2482,Pradera Asset Management PLC (GB )
Promid,17232,Praefinium Capital Limited (CY )
Promid,22735,Praude Asset Management Ltd (MT )
Promid,81613,Premier Portfolio Managers Limited (GB )
Promid,72624,Preval (LU )
Promid,21967,Prim' Finance (FR )
Promid,20072,PRIMA Fonds Service GmbH (DE )
Promid,67506,Prime Capital AG (DE )
Promid,87611,Primonial SAS (FR )
Promid,12394,Principal Global Investors EU Ltd (GB )
Promid,11137,Principal Global Investors LLC (US )
Promid,89704,Prior&Nilsson Fond och Kapitalf. AB (SE )
Promid,14888,Prisminvest S.A. (CH )
Promid,87356,PrivAccess General Partner S.à r.l. (LU )
Promid,69932,Privium Fund Management UK Ltd (GB )
Promid,18214,Probus Compagnie S.A. (CH )
Promid,80136,Probus Middle East Limited (AE )
Promid,87075,Profunda Zweite Verwalt. mbH & Co KG (DE )
Promid,84131,Progressive Capital Partners Ltd (CH )
Promid,2498,Prologis Trust (US )
Promid,81397,PROMEPAR AM (FR )
Promid,18722,Promobe Finance S.A. (LU )
Promid,15402,Promont AM AG (DE )
Promid,80187,Propo’s SAS (FR )
Promid,91691,Proxy P Management AB (SE )
Promid,12487,Prudential Corporation Holdings Ltd (GB )
Promid,10772,Prudential Properly Ivt Mgt Pte Ltd (SG )
Promid,91613,Prusik Investment Management LLP (GB )
Promid,14877,PSM Vermögensverwaltung GmbH (DE )
Promid,4768,PT Asset Management GmbH (DE )
Promid,71500,PTREL Management S.à r.l. (LU )
Promid,4465,Puilaetco Dewaay Private Bankers SA (BE )
Promid,18628,Pure Capital S.A. (LU )
Promid,83353,Pure Value Capital Partners SA (LU )
Promid,71948,Purple Development S.A.S. (FR )
Promid,78389,PvB Pernet von Ballmoos AG (CH )
Promid,113999,PVV AG (DE )
Promid,88486,Q Group Capital (LU )
Promid,81264,Qbasis Invest GmbH (AT )
Promid,18892,QS Strategic GP's (VG )
Promid,17526,Quadriga Asset Management AG (CH )
Promid,84331,Quadriga Asset Managers SGIIC SA (ES )
Promid,101708,Quadrille Capital (FR )
Promid,72708,Quadrum S.A. (LU )
Promid,68730,Quaestio Capital Mgt SGR S.p.A. (IT )
Promid,88588,Quaestio GP S.à r.l. (LU )
Promid,18827,Quaestor Vermogensbeheer NV (BE )
Promid,12830,Quantex AG (CH )
Promid,13582,Quantile S.à r.l. (LU )
Promid,89824,Quantology Capital Management (FR )
Promid,72978,Quantum (Lux) General Partner Sàrl (LU )
Promid,83311,Quattrex Finance GmbH (DE )
Promid,107483,Queens Field (FR )
Promid,73106,Queensgate Investments II S.à r.l. (LU )
Promid,71790,Queensgate Investments LLP (GB )
Promid,101174,Quercus Assets Selection S.a.r.l (LU )
Promid,101638,Quilter Investors Limited (GB )
Promid,73969,Quilvest & Partners S.A. (LU )
Promid,72983,Quilvest Capital Partners AM S.A. (LU )
Promid,1531,Quintet Private Bank (Europe) S.A. (LU )
Promid,111340,R.I. Vermögensbetreuung AG (DE )
Promid,84695,R+V Lebensversicherung AG (DE )
Promid,20030,Radio Flyer Trust (GB )
Promid,5697,Raiffeisen Kapitalanlage-Gesell. mbH (AT )
Promid,72015,Raiffeisen Salzburg Invest Kap. GmbH (AT )
Promid,11001,Raiffeisen Schweiz Genossenschaft (CH )
Promid,18731,Raiffeisen Spar+Kreditbank eG (DE )
Promid,69836,RAM Active Investments (Europe) S.A. (LU )
Promid,82921,RAM Capital SA (CH )
Promid,4854,Ramius Alternative Solutions LLC (US )
Promid,20951,Rasmala Investment Bank Ltd (AE )
Promid,22365,Rathbone Unit Trust Management Ltd (GB )
Promid,99816,Ravel Associates Limited (GB )
Promid,18452,RBC Global Asset Management Inc. (CA )
Promid,12742,"Real I.S. AG, Gesellschaft für lmmob (DE )"
Promid,72922,Redalpine Venture Partners AG (CH )
Promid,102738,Redhedge Asset Management LLP (GB )
Promid,83965,Regium Invest Est (LI )
Promid,82794,Reimann Investors Asset Mgt GmbH (DE )
Promid,15485,Reinet Investments (LU )
Promid,15538,Reitelshöfer Vermögensmanagement (DE )
Promid,81290,Renta 4 Gestora SGIIC S.A. (ES )
Promid,80106,Renta 4 Luxembourg S.A. (LU )
Promid,87223,Resilience Partners S.à r.l. (LU )
Promid,10602,responsAbility Invest AG (CH )
Promid,91558,REVEL Asset Management SAS (FR )
Promid,72562,Reyl & Cie (France) S.A.S. (FR )
Promid,80378,Rezco Investment Counsel (PTY) Ltd (ZA )
Promid,14069,Rhein Asset Management (Lux) S.A. (LU )
Promid,13001,Richelieu Gestion S.A. (FR )
Promid,17525,Rieter Fischer Partners AG (CH )
Promid,106323,Rigsave Capital Ltd (MT )
Promid,72030,RINGTURM Kapitalanlag. mbH (AT )
Promid,69141,Riskelia SAS (FR )
Promid,114170,RIV Earnings Absolute FZ-LLC (US )
Promid,71940,Rivage Investment SAS (FR )
Promid,114480,Rivean Capital B.V. (NL )
Promid,70195,Riverfield Partners LLP (GB )
Promid,87890,RiverRock General Partner S.à r.l. (LU )
Promid,72559,Rivoli Fund Management SAS (FR )
Promid,71000,RLUM (CIS) Limited (GB )
Promid,72477,RMA Asset Management (FR )
Promid,22250,RMK Timberland Group (US )
Promid,10689,Robeco Institutional Asset Mgt B.V. (NL )
Promid,11378,Robert Beer Management GmbH (DE )
Promid,101420,ROCE Capital (FR )
Promid,13480,"Rocha Dos Santos Holding SGPS, S.A. (PT )"
Promid,72560,Roche-Brune SAS (FR )
Promid,94741,Rocq Capital Management Ltd (GG )
Promid,4872,Rothschild & Cie Banque (FR )
Promid,87357,Rothschild & Co Asset Management (FR )
Promid,2748,Rothschild & Co Bank AG (CH )
Promid,73064,Rothschild & Co Investment Managers (LU )
Promid,11999,Rothschild HDF Invest Solutions SAS (FR )
Promid,87592,Rothschild Martin Maurel Asset Mgt (FR )
Promid,88065,Round Hill Capital Group LLC (US )
Promid,22462,Royal London Asset Management (GB )
Promid,71922,Royalton Partners S.A. (LU )
Promid,72044,Royce & Associates Inc (US )
Promid,5904,RPM Risk&Port Mgt AB (SE )
Promid,68861,RREEF Investment GmbH (DE )
Promid,20985,Ruffer LLP (GB )
Promid,104720,Runte.Weil & Alt GmbH (DE )
Promid,114533,Ruth Asset Management AB (SE )
Promid,74035,Ruthenium Capital AG (CH )
Promid,84507,RV Capital Management Private Ltd (SG )
Promid,87400,RWB Partners GmbH (DE )
Promid,71436,S. Andrea SPA (IT )
Promid,73361,S.E.A. Asset Management Pte. Ltd (SG )
Promid,71600,Sagard SAS (FR )
Promid,88314,Sagis Asset Management (FR )
Promid,83537,Saint Olive Gestion (FR )
Promid,83533,Salamanca Group Holdings (UK) Ld (GB )
Promid,89791,Salamandre AM (FR )
Promid,71487,Salsacate Properties Corp (SC )
Promid,70034,Salus Alpha Capital GmbH (LI )
Promid,84664,Samarang Asset Management S.A. (LU )
Promid,87417,San Maurizio Management (LU )
Promid,71674,Sanlam Asset Management (Ireland) Ld (IE )
Promid,72472,Sanso Investment Solutions (FR )
Promid,9982,Santander Asset Management (PT )
Promid,5591,Santander Asset Management Lux. S.A. (LU )
Promid,22757,Santander Asset Management UK Ltd (GB )
Promid,73410,São João Gestora de Recursos (BR )
Promid,71954,Saphir Capital Partners S.A. (LU )
Promid,108563,Sapienta Gestion (FR )
Promid,70160,Sarasin & Partners LLP - IR Branch (IE )
Promid,82817,Sarasin Funds Management (Ireland) (IE )
Promid,87768,Sarasin Investment Funds Limited (GB )
Promid,102827,Sardona Invest AG (LI )
Promid,84544,Sasfin Asset Managers (Pty) Ltd (ZA )
Promid,104998,Saudi Economic and Development CS (SA )
Promid,2011,Sauren Finanzdienstleistungen GmbH (DE )
Promid,72563,Schelcher Prince Gestion (FR )
Promid,92137,Schmitz & Cie. GmbH (DE )
Promid,72031,SCHOELLERBANK INVEST AG (AT )
Promid,18805,Schroder Investment Management AG (CH )
Promid,10861,Schroder Investment Management HK Ld (HK )
Promid,1554,Schroder Investment Mgt (Europe) SA (LU )
Promid,96917,Schroder Ivt Mgt (Guernsey) Ld (GG )
Promid,96918,Schroder Pension Management Limited (GB )
Promid,80215,Schroder Unit Trusts Limited (GB )
Promid,111252,Schroders Korea Limited (KR )
Promid,2013,Schroders plc (GB )
Promid,22151,Schweizerische Mobiliar Asset Mgt AG (CH )
Promid,20206,SCIO Capital LLP (GB )
Promid,68867,SCM Strategic Capital Management AG (CH )
Promid,84904,SCOR Investment Partners SE (FR )
Promid,2861,SCOR SE (FR )
Promid,68944,Scottish Mutual Investment M L (GB )
Promid,2852,Scottish Widows Inv Partnership Ld (GB )
Promid,87770,Scottish Widows Unit Trust Managers (GB )
Promid,95060,Seahawk Investments GmbH (DE )
Promid,4498,SEB Investment Mgt AB - LU Branch (LU )
Promid,84365,Sector Asset Management (NO )
Promid,44317,Security Kapitalanlage AG (AT )
Promid,22918,SEDCO Capital Luxembourg S.A. (LU )
Promid,18888,SEDEC Finance (FR )
Promid,83111,SEGETIA (UK) Ltd (GB )
Promid,16199,Segetia Wealth Management S.A. (CH )
Promid,9977,SEI Investments (Europe) Limited (GB )
Promid,91387,Seilern Investment Mgt (Ireland) Ltd (IE )
Promid,101770,Selection Asset Management GmbH (DE )
Promid,71949,Senior European Loan Management (LU )
Promid,93775,sepiam (FR )
Promid,91269,Septem Invest (FR )
Promid,115092,Serafin Asset Management AG (DE )
Promid,71783,Sete Holdings S.à r.l. (LU )
Promid,71135,Seven Capital Management (FR )
Promid,87056,SevenHills Investment Management Ltd (MT )
Promid,72420,SG 29 Haussmann (FR )
Promid,115558,SG IS (France) (FR )
Promid,2030,SGAM S.A. (FR )
Promid,22251,SGSS Deutschland Kapitalanlagegesel. (DE )
Promid,72810,Shaftesbury Fund Management (Lux) SA (LU )
Promid,83053,Shareholder Value Management AG (DE )
Promid,73470,ShelteR Investment Management (LU )
Promid,22111,"Shenkman Capital Management, Inc. (US )"
Promid,83667,Shield Securities Limited (GG )
Promid,2330,Shinko Securities Co. Ltd (JP )
Promid,71503,SIDI SCA (FR )
Promid,72417,Siemens Fonds Invest GmbH (DE )
Promid,84691,Siemens Pension-Trust e.V. (DE )
Promid,84285,SIGAVEST Vermögensverwaltung GmbH (DE )
Promid,68404,SIGNAL IDUNA Asset Management GmbH (DE )
Promid,84172,Signet Capital Management Limited (GB )
Promid,17855,Signina Capital AG (CH )
Promid,87412,Silex Asset Management S.à r.l. (LU )
Promid,97994,Silex Investment Managers (FR )
Promid,70638,Silkroad Management S.à R.L. (LU )
Promid,69514,Silverhorn Investment Advisors Ld (HK )
Promid,69023,Simplify Part SA (LU )
Promid,68501,Sissener AS (NO )
Promid,12190,SK Vermögensverwaltung GmbH (DE )
Promid,17572,SKAGEN AS (NO )
Promid,71296,Skandia Fonder (SE )
Promid,2021,Skandinaviska Enskilda Banken AB (SE )
Promid,1556,Skandinaviska Enskilda Banken SA (LU )
Promid,87761,Slater Investments Limited (GB )
Promid,73129,SLB International SARL (FR )
Promid,88300,SMA Gestion (FR )
Promid,2270,SMBC Nikko Group (JP )
Promid,72103,"Smead Capital Management, Inc. (US )"
Promid,83609,Smith & Williamson Investment Mgt (GB )
Promid,3214,SMN Investment Services Ltd. (BM )
Promid,5185,SMS & Cie. Vermögensmanagement GmbH (DE )
Promid,1630,Société d'Adm. Gestion Atlantas Saga (CH )
Promid,72557,Société de gestion Prévoir (FR )
Promid,91875,Société Générale Effekten GmbH (DE )
Promid,18916,Société Générale Gestion S.A (“S2G”) (FR )
Promid,13674,Societe Generale Invst Sol (Europe) (LU )
Promid,2806,Société Générale Luxembourg S.A. (LU )
Promid,98748,Société Générale Private Banking (BE )
Promid,2028,Société Générale S.A. (FR )
Promid,93359,Société Parisienne de Gestion (FR )
Promid,19914,Société Privée de Gestion de Patri. (FR )
Promid,87190,Sofidy (FR )
Promid,2807,Solutio AG (DE )
Promid,91226,SOLVECON INVEST GmbH (DE )
Promid,87767,Somerset Capital Management LLP (GB )
Promid,13834,Sorgente SGR S.p.A. (IT )
Promid,69035,Source For Alpha AG (DE )
Promid,71808,Spängler IQAM Invest GmbH (AT )
Promid,72068,S-Pankki Rahastoyhtiö Oy (FI )
Promid,5243,Sparinvest S.A. (LU )
Promid,2033,Sparkasse Schwaz AG (AT )
Promid,5593,Sparkasse Ulm (DE )
Promid,9954,SPARX Asset Management Co. Ltd (JP )
Promid,96224,SphereInvest Group Limited (MT )
Promid,80600,Spiltan Fonder AB (SE )
Promid,101012,Spinoza Capital Management Limited (MT )
Promid,89801,SPPI Finance (FR )
Promid,5614,Spuerkeess Asset Management (LU )
Promid,113994,Stabiho Investment Partners (FR )
Promid,21356,Stamina Asset Management (FR )
Promid,89846,State Street Global Advisors Eur Ltd (IE )
Promid,10425,State Street Global Advisors FR S.A. (FR )
Promid,22826,State Street Global Advisors Liq plc (IE )
Promid,16666,State Street Global Advisors Trust (US )
Promid,19385,Stefnir Asset Management Company hf. (IS )
Promid,104992,Stenham Asset Management UK PLC (GB )
Promid,83432,Stichting Atlas Investment Solutions (NL )
Promid,81658,Stichting Core Infrastructure (NL )
Promid,83433,Stichting Purple Protected Asset (NL )
Promid,11679,Stone Harbor Investment Partners (US )
Promid,93937,StoneFarm Capital LLP (GB )
Promid,88441,Stonehage Fleming IM Limited (GB )
Promid,83390,Storebrand Asset Management AS (NO )
Promid,17611,Stork Acceptance S.A. (LU )
Promid,68558,STRAND (LU )
Promid,89815,STRATEGE FINANCE SA (FR )
Promid,104781,STRATEGIC EQUITY PARTNERS S.à r.l. (LU )
Promid,80414,Strategic Investments Group Limited (GB )
Promid,78402,Stronghold Capital Pte. Ltd (SG )
Promid,21558,Strongsquad SGPS LDA (PT )
Promid,9851,Structured Invest S.A. (LU )
Promid,92139,Stubenrauch & Hölscher F GmbH (DE )
Promid,87406,Suebia Management S.à r.l. (LU )
Promid,4761,Suez Group (FR )
Promid,88328,Sully Patrimoine Gestion (FR )
Promid,70860,Sumitomo Mitsui Trust Bank Ltd (JP )
Promid,83503,SUMUS Capital S.A. (CH )
Promid,72564,Sunny Asset Management (FR )
Promid,2654,Superfund Asset Management GmbH (AT )
Promid,101014,Sura Investment Management Mexco (MX )
Promid,71780,SUSI Partners AG (CH )
Promid,10417,SVM Asset Management Limited (GB )
Promid,19855,Swan Asset Management S.A. (CH )
Promid,71979,"SwanCap GP, S.à r.l. (LU )"
Promid,70640,Swancap Investment Management S.A. (LU )
Promid,83190,SwanCap Partners Beteiligungs GmbH (DE )
Promid,22910,Swedbank AB (publ) (SE )
Promid,71186,Swedbank Management Company S.A. (LU )
Promid,68656,Swiss Advising & Consult Group Ltd (CH )
Promid,71346,Swiss Asia Financial S. Pte. Ltd (SG )
Promid,87965,Swiss Commodity Securities Limited (JE )
Promid,41648,Swiss Life AG (CH )
Promid,6062,Swiss Life Asset Management AG (CH )
Promid,16318,Swiss Life Asset Managers France (FR )
Promid,68376,Swiss Life Asset Managers Luxembourg (LU )
Promid,87165,SWISS LIFE Gestion Privée (FR )
Promid,22064,Swiss Life Investment Mgt Holding AG (CH )
Promid,2927,Swiss Life Ltd (CH )
Promid,71947,Swiss Life Property Management AG (CH )
Promid,12387,Swiss RE Funds(Lux) I (LU )
Promid,12770,Swiss Rock Asset Management AG (CH )
Promid,10400,Swisscanto Asset Management Intl SA (LU )
Promid,5709,Swisscanto Fondsleitung AG (CH )
Promid,11200,Swissinvest GmbH (CH )
Promid,72566,SwissLife Gestion Privée (FR )
Promid,14912,Swissquote Bank (CH )
Promid,11551,Sycomore Asset Management (FR )
Promid,6154,Sydbank AG (CH )
Promid,5932,Symbiotics Asset Management S.A. (CH )
Promid,87311,Synatom (BE )
Promid,69742,SYQUANT Capital SAS (FR )
Promid,100676,SYZ Capital AG (CH )
Promid,87518,T. Bailey Fund Services Limited (GB )
Promid,11230,"T. Rowe Price Associates, Inc (US )"
Promid,10373,T. Rowe Price Global Ivt Services Ld (GB )
Promid,16683,T. Rowe Price International Ltd (GB )
Promid,98249,Tabula Investment Management Limited (GB )
Promid,72873,Tages Capital LLP (GB )
Promid,102808,TAILOR AM SAS (FR )
Promid,72569,Tailor Capital S.A.S. (FR )
Promid,71807,Talanx Asset Management GmbH (DE )
Promid,72570,Talence Gestion (FR )
Promid,91333,TAM AG (DE )
Promid,14379,Tandem Partners Sàrl (LU )
Promid,71995,Tangible Assets Investments Mgt (LU )
Promid,71961,Tapiola Mutual Pension Insurance Co (FI )
Promid,10782,Tareno (Luxembourg) S.A. (LU )
Promid,91693,TAT (FR )
Promid,70120,Taunus Trust GmbH (DE )
Promid,93314,Taurus Gestion Privée SAS (FR )
Promid,87396,Tavis Capital AG (CH )
Promid,87395,Tavis Capital S.à r.l. (LU )
Promid,11940,TBF Global Asset Management GmbH (DE )
Promid,10442,TCW Investment Management Co. Inc (US )
Promid,14706,Technology Development Found. Turkey (TR )
Promid,2706,Templeton Global Advisors Limited (BS )
Promid,87366,TH RE Group Holdings Limited (GB )
Promid,87362,TH Real Estate (LU )
Promid,14790,Thalia S.A. (CH )
Promid,62931,Thames River Capital LLP (GB )
Promid,89919,THCP Holding S.A. (LU )
Promid,2112,The Bank of New York Mellon Intl Ltd (LU )
Promid,1747,The Capital Group Companies (US )
Promid,5069,The Financial Services Authority (GB )
Promid,73057,The Foundations Sarl (LU )
Promid,2434,The Industrial Bank of Japan (JP )
Promid,83427,The Planeta Industries Charitable T (IE )
Promid,13197,The Putnam Advisory Company L.L.C. (US )
Promid,69464,"The Vanguard Group, Inc. (US )"
Promid,21408,THEAM S.A.S. (FR )
Promid,13729,Third Eye Capital Management Inc. (CA )
Promid,83814,ThomasLloyd Capital LLC (US )
Promid,87030,ThomasLloyd Global Asset Mgt GmbH (DE )
Promid,20586,Thomé Asset Mgt & Asset Controlling (GB )
Promid,2729,Threadneedle Asset Management Ltd (GB )
Promid,41219,Threadneedle Investment Services LTD (GB )
Promid,5590,Threadneedle Management Lux S.A (LU )
Promid,17456,Threadneedle Property Investments Ld (GB )
Promid,71138,Three Hillls Capital Partners S.A. (LU )
Promid,107689,Three Rock Capital Management Ld (IE )
Promid,17915,Threestones Capital Management S.A. (LU )
Promid,112698,Tiger Asset Management AG (CH )
Promid,81620,Tikehau Capital Partners UK Limited (GB )
Promid,71394,Tikehau Investment Management SAS (FR )
Promid,87386,Timbercreek Value-Add GP S.à r.l. (LU )
Promid,71945,Timberland (Carry) GP Ltd (KY )
Promid,12265,Tishman Speyer (US )
Promid,21638,Titanium Finance S.A. (CH )
Promid,70225,TMF Fund Management S.A. (LU )
Promid,72418,TMW Pramerica Property Ivt GmbH (DE )
Promid,69582,TOBAM SAS (FR )
Promid,2667,Tokio Marine Asset Mgt Intl Pte Ltd (SG )
Promid,71789,Tolomeo Capital AG (CH )
Promid,83815,Tommaso Albanese (GB )
Promid,11600,TOP Vermögen AG (DE )
Promid,19715,TOP Vermögensverwaltung AG (DE )
Promid,83246,"Tortoise Capital Advisors, L.L.C. (US )"
Promid,19083,Toubkal (BZ )
Promid,72042,TradeCom Suisse AG (CH )
Promid,71250,"Transamerica Asset Management, Inc. (US )"
Promid,6347,Transtrend B.V. (NL )
Promid,71955,Travis Investment S.à r.l. (LU )
Promid,83440,"TREA Asset Mgt S.G.I.I.C., S.A (ES )"
Promid,88503,Treasury Capital Fund Solutions (GB )
Promid,80135,Trecento Asset Management (FR )
Promid,86922,TreeTop Asset Management Belgium (BE )
Promid,4965,TreeTop Asset Management S.A. (LU )
Promid,93409,Tresides Asset Management GmbH (DE )
Promid,6380,Triodos Bank N.V. (NL )
Promid,74645,Tristan Capital Partners LLP (GB )
Promid,80493,Trium Investment Management LLP (GB )
Promid,87232,TRIUM S.A. (LU )
Promid,16636,TRIUVA Kapitalverwaltungsg. (DE )
Promid,95931,Troy Asset Management Limited (GB )
Promid,115530,Truncus Wealth (BE )
Promid,72534,Trusteam Finance (France) (FR )
Promid,87749,TRUSTUS Capital Management B.V. (NL )
Promid,73459,TT International (GB )
Promid,11756,Tungsten Capital Management GmbH (DE )
Promid,89800,Turgot Asset Management (FR )
Promid,20347,Turquoise Finances S.A. (CH )
Promid,69776,TÜV SÜD Pension Trust e.V. (DE )
Promid,68662,Twelve Capital AG (CH )
Promid,72497,Twenty First Capital (FR )
Promid,80861,Twentyfour Asset Management LLP (GB )
Promid,71970,Tyndaris LLP (GB )
Promid,102868,Tyrus Capital Alternatives LLP (GB )
Promid,70039,UBP AM (Europe) SA (LU )
Promid,17076,UBS AG (Genève) (CH )
Promid,11933,UBS AG (London Branch) (GB )
Promid,19024,UBS Asset Management (Europe) S.A. (LU )
Promid,5386,UBS Asset Management (UK) Ltd  (GB )
Promid,2198,UBS Asset Management Switzerland AG (CH )
Promid,5236,UBS Asset Mgt (Deutschland) GmbH  (DE )
Promid,80388,UBS Beteiligungs-GmbH & Co. KG (DE )
Promid,83675,UBS Europe SE Luxembourg Branch (LU )
Promid,1502,UBS Fund Adminis Services Lux SA (LU )
Promid,4950,UBS Fund Management (Switzerland) AG (CH )
Promid,10298,UBS La Maison de Gestion (FR )
Promid,11518,UBS Lux Fin Group Asset Management (LU )
Promid,15717,UBS Real Estate Kapitalanlagegesell. (DE )
Promid,75356,UBS Switzerland AG (CH )
Promid,5879,UBS Third Party Management Co. S.A. (LU )
Promid,83224,UCAP GP S.à r.l. (LU )
Promid,89913,UDX GP S.à r.l. (LU )
Promid,73056,Ufenau IV German Asset Light Sàrl (LU )
Promid,114110,Uhuru Investment Partners (NE )
Promid,106037,Ullis Luxembourg SA (LU )
Promid,105979,UM Strategy Verwaltungs GmbH (DE )
Promid,100067,UmweltBank AG (DE )
Promid,72574,Uncia AM (FR )
Promid,18109,UniCredit Bank AG (DE )
Promid,15044,UniCredit International Bank (Lux)SA (LU )
Promid,73303,Unigestion (Luxembourg) (LU )
Promid,11293,Unigestion Guernsey Ltd (GG )
Promid,2064,Unigestion S.A. (CH )
Promid,74845,Unigestion Secondary Opportunity III (LU )
Promid,83681,Uni-Hedge Vaudoise I Limited (GG )
Promid,5670,Unilever N.V. (NL )
Promid,71342,Union Bancaire Gest Instit (FR) SAS (FR )
Promid,3057,"Union Bancaire Privée, UBP SA (CH )"
Promid,2067,Union Financière de France Banque (FR )
Promid,1565,Union Investment Luxembourg S.A. (LU )
Promid,5216,Union Investment Privatfonds GmbH (DE )
Promid,13097,Union Investment Real Estate AG (DE )
Promid,96442,Union Securities Switzerland SA (CH )
Promid,18622,Unipart Participações Internacionais (KY )
Promid,69855,UNIQA Capital Markets GmbH (AT )
Promid,4874,UNIQA Versicherungen AG (AT )
Promid,73764,Universal Investment (LU )
Promid,114114,Universal-Investment Ireland Fd Mgt (IE )
Promid,44536,Universal-Investment-Gesellschaft (DE )
Promid,4335,Universal-Investment-Luxembourg S.A. (LU )
Promid,71641,Urban Partners Management Company (LU )
Promid,83829,UTI International (Singapore) Priv (SG )
Promid,88378,Uzès Gestion (FR )
Promid,87802,V4C Poland Plus C.V. SCS (LU )
Promid,2990,Valartis Asset Management (Austria) (AT )
Promid,11383,Valartis Int Ltd (VG )
Promid,83591,Valeur Capital Limited (GB )
Promid,18555,Valiance Asset Management Limited (GG )
Promid,110038,Valinvest RE (GB )
Promid,72900,Valori Asset Management S.A. (LU )
Promid,78398,Valtum GP Sàrl (LU )
Promid,72060,Value Partners Limited (VG )
Promid,72049,Value Square (BE )
Promid,83139,"Value Tree A.V., S.A. (ES )"
Promid,18738,Valu-Trac Investment Management Limi (GB )
Promid,84498,VAM Global S.à r.l (LU )
Promid,16375,Van Eck Associates Corporation (US )
Promid,16321,Van Lanschot Kempen Ivt Mgt (NL )
Promid,102835,VanEck Asset Management B.V. (NL )
Promid,89851,Vanguard Global Advisers LLC (US )
Promid,72575,Varenne Capital Partners (FR )
Promid,113875,Variety Capital Limited (GB )
Promid,71992,"Varipromo, S.L. (ES )"
Promid,72580,Vatel Capital (FR )
Promid,101781,Vauban Infrastructure Partners (FR )
Promid,14729,VBV-Pensionskasse AG (AT )
Promid,21272,VCP Holdings I (Suisse) SàRL (CH )
Promid,98749,VDK Spaarbank (BE )
Promid,13000,Vector Asset Management S.A. (LU )
Promid,69417,VEGA Investment Managers (FR )
Promid,81621,Vendôme Capital Properties Lux (LU )
Promid,22681,Ver Capital SGRpA (IT )
Promid,73335,Ver Management Tre ss (IT )
Promid,14864,Vereinigte VR Bank Kur+ Rheinpfalz (DE )
Promid,81325,Veritas Investment Associates (FR )
Promid,71800,Veritas Investment GmbH (DE )
Promid,18082,Versorgungswerk der Architektenk. (DE )
Promid,84671,Vesalius Biocapital III Partners (LU )
Promid,84326,Vestathena (FR )
Promid,70859,V-Fund Trend Management Co Inc (VG )
Promid,10599,Victory Asset Management S.A. (LU )
Promid,81407,VIDA CAPITAL Inc (US )
Promid,16947,Vintage General Partner S.a r.l. (LU )
Promid,83640,Viola Asset Management GmbH (AT )
Promid,18556,Vision Holdings Limited (KY )
Promid,83148,Vistra (Malta) Limited (MT )
Promid,91284,Vistra Fund Management S.A. (LU )
Promid,88495,"Vivienne Investissement, SAS (FR )"
Promid,73477,VM Vermögens-Management GmbH (DE )
Promid,15395,VM Vermögens-Management GmbH (DE )
